ID,Guitar Name,Model,Price,Old Price,Discount,Status
526,Fender,American Vintage II 1957 Stratocaster MN Sea Foam Green Električna gitara,2.145 €,N/A,N/A,Na skladištu
527,Fender,Jim Root Telecaster Flat White Električna gitara,1.439 €,N/A,N/A,Na skladištu
528,Gibson,Les Paul Modern Figured Cherry Burst Električna gitara,2.539 €,N/A,N/A,Na skladištu
529,Fender,Player II Series Stratocaster HSS MN Black Električna gitara,760 €,N/A,N/A,Na skladištu
530,Stagg,Silveray Nash Black Električna gitara,225 €,N/A,N/A,Na skladištu
531,Fender,Player Series Stratocaster PF Sea Foam Green Električna gitara,766 €,N/A,N/A,Na skladištu
532,Henry's,Fury FS-1 Fever Gold Električna gitara,759 €,823 €,- 8 %,Na skladištu
533,Fender,Squier Paranormal Esquire Deluxe Mocha Električna gitara,430 €,N/A,N/A,Na skladištu
534,G&L,Tribute ASAT Special Surf Green Električna gitara,580 €,624 €,- 7 %,Na skladištu
535,Epiphone,SG Standard LH Alpine White Električna gitara,449 €,477 €,- 6 %,Na skladištu
536,Reverend,Guitars Jetstream 390 W Korina Burst Električna gitara (Skoro novo),"931,82 €","981,45 €",- 5 %,Na skladištu
537,Jackson,JS32L Dinky DKA AH Bright Blue Električna gitara (Skoro novo),"331,80 €","335,61 €",N/A,Na skladištu
538,Fender,Special Edition Custom Telecaster FMT HH IL Crimson Red Transparent Električna gitara,1.069 €,N/A,N/A,Na skladištu
539,ESP,LTD Viper-256 Olympic White Električna gitara,562 €,N/A,N/A,Na skladištu
540,Henry's,ST-1 Viper Yellow Relic Električna gitara,719 €,N/A,N/A,Na skladištu
541,Eko,guitars Aire Relic Sunburst Električna gitara,348 €,N/A,N/A,Na skladištu
542,Fender,Player II Series Telecaster RW Polar White Električna gitara,749 €,N/A,N/A,Na skladištu
543,Epiphone,SG Muse Radio Blue Metallic Električna gitara,490 €,N/A,N/A,Na skladištu
544,Jackson,Pro Plus Series Dinky DKAQ EB Transparent Purple Burst Električna gitara,1.135 €,N/A,N/A,Na skladištu
545,Fender,Player II Series Stratocaster HSS MN Aged Cherry Burst Električna gitara,827 €,898 €,- 8 %,Na skladištu
546,Michael,Kelly 1965 Amber Električna gitara,759 €,N/A,N/A,Na skladištu
547,Fender,Player II Series Stratocaster MN Hialeah Yellow Električna gitara,798 €,N/A,N/A,Na skladištu
548,Jackson,X Series Soloist SL3X DX LRL Oxblood Električna gitara,712 €,N/A,N/A,Na skladištu
549,Fender,MIJ Hybrid II Stratocaster HSS RW Modena Red Električna gitara,1.449 €,N/A,N/A,Na skladištu
550,Jackson,JS22 Dinky DKA AH Natural Oiled Električna gitara,231 €,N/A,N/A,Na skladištu
551,Jackson,JS32 Rhoads AH Satin Grey Električna gitara,341 €,346 €,N/A,Na skladištu
552,Fender,Squier Paranormal Custom Nashville Stratocaster Aztec Gold Električna gitara,449 €,N/A,N/A,Na skladištu
553,Yamaha,Pacifica Standard Plus MSB Sparkle Blue Električna gitara,1.149 €,N/A,N/A,Na skladištu
554,Henry's,TL-1 Stardust Black Relic Električna gitara,679 €,N/A,N/A,Na skladištu
555,Fender,MIJ Hybrid II Stratocaster HSS RW Forest Blue Električna gitara,1.489 €,N/A,N/A,Na skladištu
556,Fender,American Professional II Telecaster MN 3-Color Sunburst Električna gitara (Skoro novo),"1.764,70 €",1.929 €,- 9 %,Na skladištu
557,Fender,Vintera II 50s Stratocaster MN Ocean Turquoise Električna gitara,1.090 €,N/A,N/A,Na skladištu
558,Gretsch,G2420 Streamliner Hollow Body LRL Claret Burst Jazz gitara,519 €,N/A,N/A,Na skladištu
559,EVH,Stripe Series Red with Black Stripes Električna gitara (Oštećeno),"725,01 €","870,20 €",- 17 %,Na skladištu
560,Fender,Vintera II 50s Stratocaster MN Black Električna gitara,1.075 €,N/A,N/A,Na skladištu
561,Charvel,Pro-Mod San Dimas Style 1 HSS HT Sassafras EB Satin Black Električna gitara,965 €,N/A,N/A,Na skladištu
562,EVH,Stripe Series Red with Black Stripes Električna gitara (Skoro novo),"867,23 €","926,08 €",- 6 %,Na skladištu
563,Jackson,Pro Plus Series Soloist SLA3Q EB Polar Burst Električna gitara,1.449 €,N/A,N/A,Na skladištu
564,ESP,LTD EX-7 Baritone Black Satin Električna gitara,1.229 €,N/A,N/A,Na skladištu
565,Ibanez,RGMS7-BK Black Električna gitara,511 €,N/A,N/A,Na skladištu
566,Epiphone,ES-335 LH Cherry Jazz gitara,513 €,612 €,- 16 %,Na skladištu
567,Epiphone,Les Paul Standard '60s Iced Tea/Lijeva ruka,570 €,N/A,N/A,Na skladištu
568,Fender,American Ultra Telecaster RW Texas Tea Električna gitara (Samo otvarano),"2.217,61 €",N/A,N/A,Na skladištu
569,Fender,Player Plus Stratocaster HSS PF Belair Blue Električna gitara,990 €,N/A,N/A,Na skladištu
570,SX,STL/H 3-Tone Sunburst Električna gitara,201 €,209 €,- 4 %,Na skladištu
571,ESP,LTD EC-256 QM See Thru Black Cherry Sunburst Električna gitara,588 €,N/A,N/A,Na skladištu
572,Fender,Player II Series Jaguar RW Coral Red Električna gitara,799 €,N/A,N/A,Na skladištu
573,Fender,Player II Series Telecaster RW Birch Green Električna gitara,815 €,N/A,N/A,Na skladištu
574,Fender,Player II Series Telecaster MN Mocha Električna gitara,868 €,N/A,N/A,Na skladištu
575,Jackson,JS Series Dinky Arch Top JS32Q DKA HT AH Transparent Black Burst Električna gitara,325 €,N/A,N/A,Na skladištu
576,Fender,Player II Series Stratocaster LH RW Polar White Električna gitara,815 €,N/A,N/A,Na skladištu
577,Fender,American Professional II Stratocaster RW Dark Night Električna gitara,1.849 €,1.899 €,N/A,Na skladištu
578,Fender,Squier Classic Vibe Baritone Custom Telecaster LRL Black Električna gitara (Skoro novo),"400,69 €","434,61 €",- 8 %,Na skladištu
579,Ibanez,RGMS8-BK Black Električna gitara,616 €,N/A,N/A,Na skladištu
580,Fender,Squier Classic Vibe Baritone Custom Telecaster LRL Black Električna gitara,418 €,N/A,N/A,Na skladištu
581,Epiphone,Les Paul Custom LH Ebony Električna gitara,649 €,N/A,N/A,Na skladištu
582,Fender,MIJ Hybrid II Stratocaster HSH MN 3-Color Sunburst Električna gitara,1.409 €,1.559 €,- 10 %,Na skladištu
583,Gibson,Dave Mustaine Flying V Silver Metallic Električna gitara,2.539 €,N/A,N/A,Na skladištu
584,Charvel,Pro-Mod San Dimas Style 1 HSS HT MN Platinum Pearl Električna gitara,858 €,N/A,N/A,Na skladištu
585,Jackson,X Series KVXMG IL Satin Black Električna gitara,742 €,N/A,N/A,Na skladištu
586,Fender,American Performer Pine Stratocaster MN 2-Color Sunburst Električna gitara,1.469 €,N/A,N/A,Na skladištu
587,SX,SEA2PH 3-Tone Sunburst Električna gitara,250 €,259 €,N/A,Na skladištu
588,Fender,American Vintage II 1951 Telecaster MN Butterscotch Blonde Električna gitara (Samo otvarano),"2.066,20 €","2.276,01 €",- 9 %,Na skladištu
589,Schecter,Reaper-6 FR Charcoal Burst Električna gitara,1.239 €,N/A,N/A,Na skladištu
590,Michael,Kelly 53DB Dark Tiger's Eye Električna gitara,486 €,N/A,N/A,Na skladištu
591,ESP,LTD EX-201 Black Satin Električna gitara,613 €,N/A,N/A,Na skladištu
592,Fender,American Performer Stratocaster HSS RW 3-Tone Sunburst Električna gitara,1.459 €,N/A,N/A,Na skladištu
593,Fender,Player Series Telecaster PF 3-Tone Sunburst Električna gitara (Skoro novo),"724,32 €","771,21 €",- 6 %,Na skladištu
594,Gretsch,G2215-P90 Streamliner JR Jet Club Shell Pink Električna gitara,377 €,N/A,N/A,Na skladištu
595,Vintage,V100 Arctic White Električna gitara,592 €,N/A,N/A,Na skladištu
596,Schecter,Nick Johnston PT Atomic Green Električna gitara,1.239 €,1.259 €,N/A,Na skladištu
597,Jackson,X Series Dinky Arch Top DKAF7 IL Gloss Black Električna gitara,648 €,N/A,N/A,Na skladištu
598,Fender,American Ultra Stratocaster RW Arctic Pearl Električna gitara,2.239 €,N/A,N/A,Na skladištu
599,Fender,MIJ Hybrid Telecaster Custom MN Gold Električna gitara,1.499 €,N/A,N/A,Na skladištu
600,Fender,Player Series Telecaster HH PF 3-Tone Sunburst Električna gitara (Skoro novo),"779,23 €","830,61 €",- 6 %,Na skladištu
601,Yamaha,Pacifica Standard Plus MBL Black Električna gitara,1.249 €,N/A,N/A,Na skladištu
602,G&L,ASAT-Special Gloss Black Električna gitara,485 €,N/A,N/A,Na skladištu
603,Fender,Player II Series Telecaster RW Aquatone Blue Električna gitara,798 €,N/A,N/A,Na skladištu
604,Fender,MIJ Hybrid II Stratocaster HSH RW Black Električna gitara,1.449 €,N/A,N/A,Na skladištu
605,Fender,American Professional II Stratocaster RW Anniversary 2-Color Sunburst Električna gitara,1.959 €,N/A,N/A,Na skladištu
606,Fender,American Professional II Stratocaster RW Anniversary 2-Color Sunburst Električna gitara (Samo otvarano),"1.717,71 €","1.861,05 €",- 8 %,Na skladištu
607,Danelectro,59XT Gloss Black Električna gitara,669 €,839 €,- 20 %,Na skladištu
608,Charvel,Guthrie Govan Signature MJ San Dimas SD24 CM 3-Tone Sunburst Električna gitara,2.219 €,N/A,N/A,Na skladištu
609,Fender,Ed O'Brien Stratocaster MN Olympic White Električna gitara,1.390 €,N/A,N/A,Na skladištu
610,Fender,American Professional II Telecaster MN Sienna Sunburst Električna gitara,1.789 €,1.899 €,- 6 %,Na skladištu
611,Fender,Player Series Telecaster MN 3-Tone Sunburst Električna gitara (Skoro novo),"743,40 €","791,01 €",- 6 %,Na skladištu
612,Yamaha,SA2200-BS Brown Sunburst Jazz gitara,2.219 €,"2.476,95 €",- 10 %,Na skladištu
613,Fender,Squier Paranormal Esquire Deluxe Metallic Black Električna gitara,430 €,N/A,N/A,Na skladištu
614,Epiphone,Les Paul Studio Alpine White Električna gitara (Skoro novo),"507,55 €",N/A,N/A,Na skladištu
615,Fender,Squier Paranormal Strat-O-Sonic Crimson Red Transparent Električna gitara,428 €,N/A,N/A,Na skladištu
616,Fender,American Professional II Stratocaster MN HSS Olympic White Električna gitara,2.039 €,N/A,N/A,Na skladištu
617,Fender,American Professional II Stratocaster MN 3-Tone Sunburst Električna gitara,1.799 €,N/A,N/A,Na skladištu
618,Fender,American Vintage II 1973 Stratocaster MN Lake Placid Blue Električna gitara,2.399 €,N/A,N/A,Na skladištu
619,Ibanez,RG320EXZ-BKF Black Električna gitara (Skoro novo),"462,35 €","502,56 €",- 8 %,Na skladištu
620,Fender, Limited Edition Tom Delonge Stratocaster Surf Green Električna gitara,1.459 €,N/A,N/A,Na skladištu
621,Chapman,Guitars ML3 Pro X Gloss Silver Metallic Električna gitara,1.499 €,N/A,N/A,Na skladištu
622,Fender,Tom Morello Stratocaster RW Black Električna gitara,1.459 €,N/A,N/A,Na skladištu
623,SX,STL/H Natural Električna gitara (Oštećeno),"153,55 €","172,43 €",- 11 %,Na skladištu
624,ESP,LTD M-201HT Black Satin Električna gitara,439 €,488 €,- 10 %,Na skladištu
625,Encore,E99 LH Gloss Black Električna gitara,210 €,N/A,N/A,Na skladištu
626,Yamaha,RSE20 Vintage White Električna gitara,445 €,N/A,N/A,Na skladištu
627,Ibanez,RG421S-SEM Sea Shore Matte Električna gitara,409 €,N/A,N/A,Na skladištu
628,Fender,Ultra Luxe Stratocaster RW 2-Color Sunburst Električna gitara,2.444 €,N/A,N/A,Na skladištu
629,Fender,American Ultra Luxe Telecaster FR HH MN Mystic Black Električna gitara,2.519 €,N/A,N/A,Na skladištu
630,Jackson,American Series Soloist SL3 Black Električna gitara,2.079 €,2.189 €,- 5 %,Na skladištu
631,Fender,Ultra Luxe Stratocaster RW 2-Color Sunburst Električna gitara (Skoro novo),"2.261,82 €","2.341,49 €",N/A,Na skladištu
632,Henry's,ST-1 Boa Pink Relic Električna gitara,578 €,N/A,N/A,Na skladištu
633,Fender,Special Edition Custom Telecaster FMT HH IL Amber Električna gitara,1.045 €,N/A,N/A,Na skladištu
634,ESP,LTD Alexi 200 Black Električna gitara,598 €,N/A,N/A,Na skladištu
635,Sire,Larry Carlton H7 White Jazz gitara (Skoro novo),"548,19 €","614,08 €",- 11 %,Na skladištu
636,Fender,MIJ Hybrid II Stratocaster HSS RW Black Električna gitara,1.399 €,N/A,N/A,Na skladištu
637,Jackson,X Series Soloist SLX DX Red Crystal Električna gitara,647 €,N/A,N/A,Na skladištu
638,Sire,Larry Carlton H7 White Jazz gitara (Oštećeno),"490,22 €","618,51 €",- 21 %,Na skladištu
639,Sire,Larry Carlton H7 White Jazz gitara (Skoro novo),"567,44 €","618,51 €",- 8 %,Na skladištu
640,Gretsch,G5422TG Electromatic DC LRL Walnut Stain Jazz gitara,942 €,N/A,N/A,Na skladištu
641,Reverend,Guitars Charger 290 Venetian Pearl Električna gitara,888 €,N/A,N/A,Na skladištu
642,G&L,Bluesboy Clear Orange Jazz gitara,719 €,N/A,N/A,Na skladištu
643,Yamaha,Pacifica 612 VII FMX Fired Red Električna gitara,883 €,N/A,N/A,Na skladištu
644,Fender,Ultra Luxe Stratocaster MN Plasma Red Burst Električna gitara,2.444 €,N/A,N/A,Na skladištu
645,Gibson,SG Standard Translucent Teal Električna gitara,1.555 €,N/A,N/A,Na skladištu
646,Fender,Squier Affinity Series Starcaster Deluxe LRL Olympic White Jazz gitara,304 €,N/A,N/A,Na skladištu
647,Gibson,SG Modern 2020 Trans Black Fade Električna gitara,2.139 €,2.249 €,- 5 %,Na skladištu
648,Fender,Limited Edition Tom Delonge Stratocaster Black Električna gitara,1.569 €,N/A,N/A,Na skladištu
649,Jackson,Pro Series Rob Cavestany Death Angel Black Električna gitara,1.069 €,N/A,N/A,Na skladištu
650,Sire,Larry Carlton H7 White Jazz gitara (Skoro novo),"616,14 €","672,21 €",- 8 %,Na skladištu
651,Cort,G200 Sky Blue Električna gitara,243 €,N/A,N/A,Na skladištu
652,Gretsch,G5230T Nick13 Electromatic Jet Black Električna gitara,642 €,N/A,N/A,Na skladištu
653,Fender,American Vintage II 1961 Stratocaster RW 3-Color Sunburst Električna gitara,2.169 €,N/A,N/A,Na skladištu
654,Fender,American Professional II Stratocaster MN Sienna Sunburst Električna gitara,1.959 €,N/A,N/A,Na skladištu
655,Ibanez,S521-MOL Mahogany Oil Električna gitara,399 €,N/A,N/A,Na skladištu
656,Eko,guitars Tero Relic Olympic White Električna gitara,298 €,N/A,N/A,Na skladištu
657,Michael,Kelly 1953 Blue Jean Wash Električna gitara,455 €,N/A,N/A,Na skladištu
658,Chapman,Guitars ML1 X Deep Blue Gloss Električna gitara,598 €,N/A,N/A,Na skladištu
659,Fender,Player Plus Telecaster PF Silver Smoke Električna gitara,974 €,N/A,N/A,Na skladištu
660,Fender,Squier Affinity Series Starcaster MN Olympic White Jazz gitara,343 €,350 €,N/A,Na skladištu
661,Fender,Vintera 60s Stratocaster PF 3-Tone Sunburst Električna gitara (Oštećeno),"903,28 €","938,56 €",- 4 %,Na skladištu
662,Schecter,BANSHEE-6 SGR Electric Blue Električna gitara,310 €,N/A,N/A,Na skladištu
663,Schecter,Nick Johnston Atomic Snow Električna gitara,999 €,N/A,N/A,Na skladištu
664,Fender,Squier FSR Classic Vibe 70s Jaguar LRL Gold Sparkle Električna gitara (Oštećeno),"417,14 €","446,51 €",- 7 %,Na skladištu
665,Vintage,V100 Arctic White Električna gitara (Samo otvarano),"564,60 €","589,05 €",- 4 %,Na skladištu
666,Fender,Jimmy Page Telecaster RW Natural Električna gitara,1.575 €,N/A,N/A,Na skladištu
667,Michael,Kelly Custom Collection Patriot Partial Eclipse Električna gitara,609 €,N/A,N/A,Na skladištu
668,Gibson,Les Paul Modern Figured SeaFoam Green Električna gitara,2.829 €,N/A,N/A,Na skladištu
669,ESP,LTD EC-200DX Blue Burst Električna gitara,498 €,N/A,N/A,Na skladištu
670,Fender,Jeff Beck Stratocaster Olympic White Električna gitara (Samo otvarano),"2.292,96 €","2.409,40 €",- 5 %,Na skladištu
671,Fender,American Professional II Telecaster Deluxe RW Dark Night Električna gitara,1.919 €,1.959 €,N/A,Na skladištu
672,Vintage,V100 Flame Amber Električna gitara,511 €,N/A,N/A,Na skladištu
673,Yamaha,Pacifica 212V QM Caramel Brown Električna gitara,421 €,N/A,N/A,Na skladištu
674,Yamaha,RSP02T Sunset Burst Električna gitara,1.899 €,N/A,N/A,Na skladištu
675,Epiphone,Tony Iommi SG Special LH Vintage Cherry Električna gitara,926 €,N/A,N/A,Na skladištu
676,Epiphone,Les Paul Standard 60s LH Bourbon Burst Električna gitara,525 €,603 €,- 13 %,Na skladištu
677,Gibson,ES-339 Transparent Ebony Jazz gitara (Samo otvarano),"2.656,39 €","2.998,71 €",- 11 %,Na skladištu
678,Yamaha,Pacifica 212V FM Tabacco Brown Sunburst Električna gitara,423 €,N/A,N/A,Na skladištu
679,Fender,Player II Series Jaguar RW Polar White Električna gitara,798 €,N/A,N/A,Na skladištu
680,G&L,Comanche RW Olympic White Električna gitara,780 €,N/A,N/A,Na skladištu
681,Charvel,Angel Vivaldi Signature Pro-Mod DK24-6 Nova MN Lucerne Aqua Firemist Električna gitara (Oštećeno),"874,28 €","979,75 €",- 11 %,Na skladištu
682,Charvel,Angel Vivaldi Signature Pro-Mod DK24-6 Nova MN Lucerne Aqua Firemist Električna gitara,1.309 €,N/A,N/A,Na skladištu
683,Jackson,X Series Soloist SLX DX Silver Mercury Crackle Električna gitara,848 €,N/A,N/A,Na skladištu
684,EVH,Wolfgang Special Stealth Black Električna gitara,1.049 €,N/A,N/A,Na skladištu
685,Charvel,Jim Root Pro-Mod San Dimas Style 1 HH FR E Satin White Električna gitara,1.379 €,N/A,N/A,Na skladištu
686,Epiphone,Dave Mustaine Prophecy Flying V Aged Dark Red Burst Električna gitara,1.509 €,N/A,N/A,Na skladištu
687,Vintage,V6HMRSB Distressed Sunburst Električna gitara,543 €,N/A,N/A,Na skladištu
688,Schecter,PT-M/M Black Električna gitara,784 €,835 €,- 6 %,Na skladištu
689,Epiphone,Les Paul Standard '50s SET Metallic Gold/Lijeva ruka,579 €,N/A,N/A,Na skladištu
690,Fender,American Performer Telecaster MN Vintage White Električna gitara (Samo otvarano),"1.405,47 €","1.484,01 €",- 5 %,Na skladištu
691,Fender,American Professional II Stratocaster MN Miami Blue Električna gitara,1.899 €,N/A,N/A,Na skladištu
692,Fender,American Vintage II 1951 Telecaster LH MN Butterscotch Blonde Električna gitara,2.109 €,N/A,N/A,Na skladištu
693,Gretsch,G5422G-12 Electromatic DC LRL Single Barrel Burst Jazz gitara,971 €,N/A,N/A,Na skladištu
694,Jackson,Pro Series Josh Smith Soloist SL7 ET Aquamarine Električna gitara,1.639 €,N/A,N/A,Na skladištu
695,G&L,Tribute ASAT Special Surf Green Električna gitara (Samo otvarano),"548,38 €","592,32 €",- 7 %,Na skladištu
696,Gibson,Dave Mustaine Flying V Silver Metallic Električna gitara (Oštećeno),"2.068,63 €","2.163,75 €",- 4 %,Na skladištu
697,Fender,American Performer Pine Stratocaster MN 2-Color Sunburst Električna gitara (Samo otvarano),"1.424,93 €",N/A,N/A,Na skladištu
698,Epiphone,Emily Wolfe Sheraton White Wolfe Aged Bone White Jazz gitara,766 €,N/A,N/A,Na skladištu
699,Fender,American Professional II Telecaster RW 3-Color Sunburst Električna gitara,1.799 €,N/A,N/A,Na skladištu
700,Gibson,SG Standard TV Yellow Električna gitara,1.659 €,N/A,N/A,Na skladištu
701,ESP,LTD Vulture Black Satin Električna gitara,1.669 €,N/A,N/A,Na skladištu
702,Fender,American Vintage II 1972 Telecaster Thinline MN Aged Natural Električna gitara,2.290 €,N/A,N/A,Na skladištu
703,Gretsch,G6120TG Players Edition Nashville Orange Satin Jazz gitara,2.539 €,2.589 €,N/A,Na skladištu
704,Fender,Jimi Hendrix Stratocaster MN Olympic White Električna gitara,1.139 €,N/A,N/A,Na skladištu
705,Gretsch,G5232T Electromatic Double Jet FT Midnight Sapphire Električna gitara,576 €,N/A,N/A,Na skladištu
706,Fender,Jimi Hendrix Stratocaster MN Olympic White Električna gitara (Samo otvarano),"1.091,74 €","1.141,28 €",- 4 %,Na skladištu
707,Fender,American Ultra Telecaster RW Ultraburst Električna gitara,2.309 €,N/A,N/A,Na skladištu
708,Chapman,Guitars ML2 Slate Black Satin Električna gitara,677 €,N/A,N/A,Na skladištu
709,Fender,American Ultra Telecaster MN Ultraburst Električna gitara,2.139 €,N/A,N/A,Na skladištu
710,Fender,American Ultra Stratocaster HSS MN Arctic Pearl Električna gitara,2.229 €,2.269 €,N/A,Na skladištu
711,Gretsch,G5655TG Electromatic CB JR IL Azure Metallic Jazz gitara,890 €,899 €,N/A,Na skladištu
712,Fender,Ritchie Blackmore Stratocaster Scalloped RW Olympic White Električna gitara,1.379 €,N/A,N/A,Na skladištu
713,Fender,Player Plus Meteora HH PF Belair Blue Električna gitara,1.029 €,N/A,N/A,Na skladištu
714,Fender,American Professional II Stratocaster MN HSS Mystic Surf Green Električna gitara,2.029 €,2.089 €,N/A,Na skladištu
715,Gibson,Les Paul Standard 50s Plain Top Sparkling Burgundy Električna gitara,2.319 €,N/A,N/A,Na skladištu
716,Epiphone,SG Custom LH Ebony Električna gitara,506 €,N/A,N/A,Na skladištu
717,Fender,MIJ Limited International Color Telecaster MN Monaco Yellow Električna gitara,1.469 €,N/A,N/A,Na skladištu
718,Yamaha,Pacifica 120H Vintage White Električna gitara,337 €,N/A,N/A,Na skladištu
719,Yamaha,Pacifica 120H Vintage White Električna gitara (Samo otvarano),"332,68 €","345,51 €",- 4 %,Na skladištu
720,Fender, Limited Edition Tom Delonge Stratocaster Graffiti Yellow Električna gitara,1.189 €,N/A,N/A,Na skladištu
721,Chapman,Guitars ML1 X Deep Red Gloss Električna gitara (Samo otvarano),543 €,N/A,N/A,Na skladištu
722,Ibanez,JIVA10 Deep Space Blonde Električna gitara,1.419 €,N/A,N/A,Na skladištu
723,Reverend,Guitars Double Agent W Outfield Ivy Električna gitara (Samo otvarano),"971,51 €","1.025,89 €",- 5 %,Na skladištu
724,Henry's,ST-1 Cobra Red Relic Električna gitara,719 €,N/A,N/A,Na skladištu
725,Fender,American Ultra Telecaster MN Mocha Burst Električna gitara,2.189 €,N/A,N/A,Na skladištu
726,Michael,Kelly 1954 Satin Black Električna gitara (Samo otvarano),"475,21 €","494,01 €",- 4 %,Na skladištu
727,Cort,G300 Raw Natural Satin Električna gitara,840 €,N/A,N/A,Na skladištu
728,Ibanez,AF95FM-AYS Antique Yellow Burst Jazz gitara,696 €,N/A,N/A,Na skladištu
729,ESP,LTD EC-201 FT See Thru Black Cherry Električna gitara,436 €,466 €,- 6 %,Na skladištu
730,EVH,Wolfgang Standard Exotic Bocote Baked MN Natural Električna gitara,629 €,N/A,N/A,Na skladištu
731,Gibson,80s Flying V Ebony Električna gitara,2.199 €,N/A,N/A,Na skladištu
732,Jackson,Pro Series Dinky Modern ET7 Primer Gray Električna gitara,1.619 €,N/A,N/A,Na skladištu
733,Epiphone,Les Paul Standard '50s SET Vintage Sunburst/Lijeva ruka,610 €,N/A,N/A,Na skladištu
734,ESP,LTD Alexi 200 Black Električna gitara (Oštećeno),"540,73 €","554,76 €",N/A,Na skladištu
735,Vintage,V6MRLB Distressed Laguna Blue Električna gitara (Samo otvarano),"480,87 €","513,81 €",- 6 %,Na skladištu
736,Vintage,V6MRLB Distressed Laguna Blue Električna gitara,506 €,N/A,N/A,Na skladištu
737,Traveler,Guitar Travelcaster Deluxe Surf Green Električna gitara,303 €,359 €,- 16 %,Na skladištu
738,Jackson,X Series Dinky Arch Top DKAF8 IL Gloss Black Električna gitara,723 €,N/A,N/A,Na skladištu
739,Jackson,JS Series Rhoads JS32 AH Black with White Bevels Električna gitara,365 €,371 €,N/A,Na skladištu
740,Jackson,X Series Scott Ian King V Baldini Električna gitara,811 €,N/A,N/A,Na skladištu
741,Fender,JV Modified 50s Stratocaster HSS MN 2-Tone Sunburst Električna gitara,1.259 €,N/A,N/A,Na skladištu
742,Gibson,Slash Les Paul Standard LH November Burst Električna gitara (Samo otvarano),"2.874,63 €","2.960,10 €",N/A,Na skladištu
743,Epiphone,Emperor Swingster Forest Green Jazz gitara,749 €,N/A,N/A,Na skladištu
744,Epiphone,Waxx Nighthawk Studio Pelham Blue Električna gitara,697 €,722 €,N/A,Na skladištu
745,Fender,Player Series Stratocaster PF Black Električna gitara,693 €,819 €,- 15 %,Na skladištu
746,ESP,LTD Viper-256 SeeThru Black Cherry Električna gitara (Oštećeno),"338,26 €","466,41 €",- 27 %,Na skladištu
747,ESP,LTD Viper-256 SeeThru Black Cherry Električna gitara (Samo otvarano),"504,01 €","513,81 €",N/A,Na skladištu
748,Cort,Yorktown TAB Tabacco Burst Jazz gitara,538 €,N/A,N/A,Na skladištu
749,Gretsch,G5622T Electromatic Center Block IL Speyside Jazz gitara,777 €,N/A,N/A,Na skladištu
750,PRS,SE Silver Sky Overland Gray Električna gitara,909 €,N/A,N/A,Na skladištu
751,Chapman,Guitars ML1 X Black Električna gitara,474 €,479 €,N/A,Na skladištu
752,Ibanez,AM93QM-JBB Jet Blue Burst Jazz gitara,643 €,N/A,N/A,Na skladištu
753,Yamaha,Pacifica 212V QM Tabacco Brown Sunburst Električna gitara,443 €,N/A,N/A,Na skladištu
754,EVH,Wolfgang WG Standard Natural Ziricote Električna gitara,627 €,651 €,- 4 %,Na skladištu
755,Epiphone,Les Paul Standard '50s SET Heritage Cherry Sunburst/Lijeva ruka,591 €,603 €,N/A,Na skladištu
756,Fender,Buddy Guy Standard Stratocaster MN Polka Dot Finish Električna gitara,1.079 €,1.099 €,N/A,Na skladištu
757,Gibson,SG Standard TV Yellow Električna gitara (Samo otvarano),"1.609,23 €",N/A,N/A,Na skladištu
758,Fender,Squier FSR Affinity Series Telecaster HH Metallic Orange Električna gitara (Skoro novo),"261,04 €",N/A,N/A,Na skladištu
759,ESP,LTD EC-256 Vintage Gold Satin Električna gitara,509 €,568 €,- 10 %,Na skladištu
760,ESP,LTD H-200FM Dark Brown Sunburst Električna gitara (Skoro novo),"646,13 €","684,52 €",- 6 %,Na skladištu
761,Fender,Squier Classic Vibe Baritone Custom Telecaster LRL 3-Tone Sunburst Električna gitara,414 €,431 €,- 4 %,Na skladištu
762,Encore,E90 Blaster Gloss Black Električna gitara,167 €,172 €,N/A,Na skladištu
763,Fender,Squier FSR Affinity Series Telecaster HH Metallic Orange Električna gitara (Skoro novo),"289,18 €","305,91 €",- 5 %,Na skladištu
764,Fender,Squier Paranormal Strat-O-Sonic Vintage Blonde Električna gitara,397 €,N/A,N/A,Na skladištu
765,Jackson,Pro Series Misha Mansoor Juggernaut 7 Black Električna gitara,875 €,888 €,N/A,Na skladištu
766,EVH,5150 Series Deluxe QM EB Purple Daze Električna gitara,1.149 €,N/A,N/A,Na skladištu
767,EVH,5150 Series Deluxe QM EB Purple Daze Električna gitara (Skoro novo),"1.034,49 €","1.083,09 €",- 4 %,Na skladištu
768,Fender,Vintera II 70s Telecaster Deluxe MN Vintage White Električna gitara,1.129 €,N/A,N/A,Na skladištu
769,Chapman,Guitars ML3 Traditional Radiant Stream Električna gitara (Oštećeno),"449,97 €","502,90 €",- 11 %,Na skladištu
