ID,Guitar Name,Model,Price,Old Price,Discount,Status
1015,Yamaha,Pacifica 612 VIIX Yellow Natural Satin Električna gitara,949 €,N/A,N/A,Nije na skladištu
1016,Fender,American Performer Telecaster RW Honey Burst Električna gitara,1.399 €,N/A,N/A,Na putu
1017,Ibanez,RG7421PB-SBF Sapphire Blue Električna gitara,640 €,N/A,N/A,Na putu
1018,ESP,LTD Phoenix-7 Baritone Black Satin Električna gitara,1.190 €,N/A,N/A,Nije na skladištu
1019,SX,SEA1PH Vintage Natural Električna gitara,303 €,N/A,N/A,Na putu
1020,Fender,Squier Classic Vibe 60s Telecaster Thinline Natural Električna gitara,396 €,N/A,N/A,Na putu
1021,Epiphone,1958 Korina Flying V Aged Natural Električna gitara,1.139 €,N/A,N/A,Na putu
1022,Sire,Larry Carlton H7 Cherry Sunburst Jazz gitara,611 €,N/A,N/A,Na putu
1023,Ibanez,RGA42FM-DEF Dragon Eye Burst Flat Električna gitara,400 €,N/A,N/A,Na putu
1024,Ibanez,GRG121SP-BMC Blue Metal Chameleon Električna gitara,315 €,N/A,N/A,Na putu
1025,Fender,Player Series Stratocaster MN Polar White Električna gitara,706 €,764 €,- 8 %,Na putu
1026,Gibson,Les Paul Standard 60s Iced Tea Električna gitara,2.509 €,2.549 €,N/A,Na putu
1027,Fender,Squier Classic Vibe 60s Stratocaster IL Lake Placid Blue Električna gitara,390 €,N/A,N/A,Nije na skladištu
1028,Vintage,V100 Flamed Thru Black Električna gitara,579 €,N/A,N/A,Na putu
1029,Fender,Squier Contemporary Stratocaster Special HT LRL Black Pearl White Električna gitara,459 €,N/A,N/A,Nije na skladištu
1030,Ibanez,RG8-WH White Električna gitara,541 €,N/A,N/A,Na putu
1031,Fender,Squier Classic Vibe 50s Stratocaster MN White Blonde Električna gitara,396 €,N/A,N/A,Na putu
1032,Charvel,Pro-Mod So-Cal Style 2 24 HH 2PT CM Natural Ash Električna gitara,1.139 €,N/A,N/A,Nije na skladištu
1033,Jackson,JS32T Warrior AH Natural Oil Električna gitara,313 €,N/A,N/A,Nije na skladištu
1034,Jackson,X Series Kelly KEXS IL Shattered Mirror Električna gitara,798 €,N/A,N/A,Nije na skladištu
1035,Fender,Player II Series Stratocaster HSS RW Coral Red Električna gitara,744 €,N/A,N/A,Na putu
1036,Fender,Squier Classic Vibe 50s Telecaster MN Butterscotch Blonde Električna gitara,394 €,N/A,N/A,Na putu
1037,Yamaha,Pacifica 120H Tobacco Brown Sunburst Električna gitara,353 €,N/A,N/A,Na putu
1038,Sire,Larry Carlton T3 Dakota Red Električna gitara,428 €,N/A,N/A,Na putu
1039,Gibson,SG Standard Ebony Električna gitara,1.519 €,1.579 €,- 4 %,Na putu
1040,Fender,Player Series Telecaster SS MN Daytona Blue Električna gitara,975 €,N/A,N/A,Nije na skladištu
1041,ESP,LTD EC-257 Black Satin Električna gitara,598 €,N/A,N/A,Nije na skladištu
1042,Yamaha,Pacifica 612 VIIX Matte Silk Blue Električna gitara,996 €,N/A,N/A,Nije na skladištu
1043,Epiphone,Tony Iommi SG Special Vintage Cherry Električna gitara,1.009 €,N/A,N/A,Nije na skladištu
1044,Jackson,X Series Dinky DK3XR HSS IL Gloss Black Električna gitara,606 €,N/A,N/A,Nije na skladištu
1045,Fender,Squier Classic Vibe '70s Stratocaster IL Olympic White Električna gitara,375 €,N/A,N/A,Na putu
1046,SX,STL/ASH Natural Električna gitara,275 €,N/A,N/A,Na putu
1047,Sire,Larry Carlton S7 3-Tone Sunburst Električna gitara,619 €,N/A,N/A,Na putu
1048,Fender,Player Series Stratocaster PF Black Električna gitara,700 €,745 €,- 6 %,Nije na skladištu
1049,Jackson,X Series Soloist SLXM DX MN Snow White Električna gitara,664 €,N/A,N/A,Na putu
1050,Charvel,Joe Duplantier Signature Pro-Mod San Dimas Style 2 HH E Natural Električna gitara,911 €,N/A,N/A,Nije na skladištu
1051,Epiphone,Jimi Hendrix Love Drops Flying V Black Električna gitara,1.839 €,N/A,N/A,Nije na skladištu
1052,Gibson,Les Paul Standard 50s Gold Top Električna gitara,3.079 €,N/A,N/A,Na putu
1053,Fender,Squier Affinity Series Telecaster LRL WPG Lake Placid Blue Električna gitara,232 €,N/A,N/A,Na putu
1054,Legator,N6FS Ninja Solar Eclipse Električna gitara,569 €,N/A,N/A,Nije na skladištu
1055,SX,EF3D Desert Sunburst Električna gitara,294 €,N/A,N/A,Na putu
1056,Fender,MIJ Hybrid II Stratocaster HSS RW 3-Color Sunburst Električna gitara,1.469 €,N/A,N/A,Na putu
1057,Gibson,Les Paul Standard 60s Faded Vintage Bourbon Burst Električna gitara,2.290 €,2.409 €,- 5 %,Nije na skladištu
1058,Epiphone,Joan Jett Olympic Special Aged Classic White Električna gitara,618 €,N/A,N/A,Nije na skladištu
1059,Sire,Larry Carlton S7 Sherwood Green Električna gitara,589 €,N/A,N/A,Na putu
1060,Fender,Squier Affinity Series Jaguar MN Mystic Metallic Brown Električna gitara,253 €,299 €,- 15 %,Na putu
1061,Fender,Player Series Stratocaster PF 3-Tone Sunburst Električna gitara,"779,43 €",N/A,N/A,Nije na skladištu
1062,Sire,Larry Carlton L7 White Električna gitara,634 €,N/A,N/A,Na putu
1063,Sire,Larry Carlton T7 Tobacco Sunburst Električna gitara,576 €,N/A,N/A,Na putu
1064,Gibson,Les Paul Standard 60s Mahogany Top TV Yellow Električna gitara,2.939 €,N/A,N/A,Nije na skladištu
1065,Fender,Player Series Telecaster MN Tidepool Električna gitara,821 €,N/A,N/A,Nije na skladištu
1066,Fender,Player Series Telecaster HH MN Tidepool Električna gitara,841 €,N/A,N/A,Nije na skladištu
1067,Sire,Larry Carlton T7 Butterscotch Blonde Električna gitara,572 €,N/A,N/A,Na putu
1068,Sire,Larry Carlton L7V Tobacco Sunburst Električna gitara,619 €,N/A,N/A,Na putu
1069,Epiphone,Firebird Vintage Sunburst Električna gitara,715 €,N/A,N/A,Nije na skladištu
1070,Ibanez,RG8EX-BKF Black Flat Električna gitara,568 €,N/A,N/A,Na putu
1071,Epiphone,Riviera Royal Tan Jazz gitara,617 €,656 €,- 6 %,Nije na skladištu
1072,Schecter,C-6 Pro Aqua Burst Električna gitara,830 €,N/A,N/A,Na putu
1073,Ibanez,GRX70QAL-TBB Transparent Blue Burst Električna gitara,297 €,N/A,N/A,Na putu
1074,SX,Vintage ST 57 Vintage White Električna gitara,154 €,N/A,N/A,Na putu
1075,Reverend,Guitars Double Agent W Chronic Blue Električna gitara,1.089 €,1.129 €,- 4 %,Nije na skladištu
1076,Reverend,Guitars Double Agent W Periwinkle Burst Električna gitara,848 €,N/A,N/A,Nije na skladištu
1077,SX,SST/ASH Transparent Black Električna gitara,294 €,N/A,N/A,Na putu
1078,Ibanez,AS53-TF Tobacco Flat Jazz gitara,328 €,N/A,N/A,Na putu
1079,Sire,Larry Carlton T7 FM Transparent Black Električna gitara,675 €,N/A,N/A,Na putu
1080,Sire,Larry Carlton H7V Black Jazz gitara,685 €,N/A,N/A,Na putu
1081,Epiphone,Les Paul Custom Ebony Električna gitara,1.290 €,N/A,N/A,Nije na skladištu
1082,Cort,KX100 Iron Oxide Električna gitara,251 €,N/A,N/A,Na putu
1083,Sire,Larry Carlton H7V Cherry Sunburst Jazz gitara,609 €,N/A,N/A,Na putu
1084,Ibanez,AZES31-AOC Arctic Ocean Metallic Električna gitara,285 €,298 €,- 4 %,Na putu
1085,Sire,Larry Carlton H7 Vintage Sunburst Jazz gitara,648 €,N/A,N/A,Na putu
1086,Sire,Larry Carlton S3 Black Električna gitara,452 €,N/A,N/A,Na putu
1087,Gibson,Les Paul Classic Translucent Cherry Električna gitara,2.299 €,N/A,N/A,Nije na skladištu
1088,Fender,Player Series Telecaster MN Pacific Peach Električna gitara,849 €,889 €,- 5 %,Nije na skladištu
1089,Epiphone,Les Paul Studio Smokehouse Burst Električna gitara,583 €,N/A,N/A,Nije na skladištu
1090,Epiphone,1958 Korina Explorer Aged Natural Električna gitara (Samo otvarano),"1.232,96 €",N/A,N/A,Nije na skladištu
1091,Sire,Larry Carlton L7 Tobacco Sunburst Električna gitara,579 €,N/A,N/A,Na putu
1092,Fender,American Professional II Telecaster RW Dark Night Električna gitara (Samo otvarano),"1.870,55 €",N/A,N/A,Nije na skladištu
1093,Sire,Larry Carlton S7 Vintage Black Električna gitara,528 €,N/A,N/A,Na putu
1094,SX,Vintage ST 57 Black Električna gitara,151 €,N/A,N/A,Na putu
1095,Epiphone,Les Paul Special-II Vintage Sunburst Električna gitara,299 €,N/A,N/A,Nije na skladištu
1096,Fender,Squier Contemporary Active Starcaster MN Ice Blue Metallic Jazz gitara (Samo otvarano),390 €,N/A,N/A,Nije na skladištu
1097,Fender,Player Series Telecaster MN 3-Tone Sunburst Električna gitara,799 €,N/A,N/A,Nije na skladištu
1098,Fender,Squier Contemporary Active Starcaster RMN Gunmetal Metallic Jazz gitara,476 €,N/A,N/A,Na putu
1099,Fender,Squier Bullet Stratocaster Tremolo HSS IL Brown Sunburst Električna gitara,184 €,N/A,N/A,Nije na skladištu
1100,ESP,LTD EC-256 FM See Thru Purple Sunburst Električna gitara,594 €,N/A,N/A,Nije na skladištu
1101,Epiphone,Slash Les Paul November Burst Električna gitara,926 €,N/A,N/A,Nije na skladištu
1102,Schecter,Reaper-6 Satin Sky Burst Električna gitara,946 €,N/A,N/A,Na putu
1103,Yamaha,RSS02T Black Električna gitara,871 €,N/A,N/A,Na putu
1104,Michael,Kelly 1955 Custom Collection Striped Ebony Električna gitara,729 €,N/A,N/A,Na putu
1105,Sire,Larry Carlton T7 FM Transparent Blue Električna gitara,638 €,N/A,N/A,Na putu
1106,Gibson,Les Paul Studio Ebony Električna gitara,1.609 €,N/A,N/A,Nije na skladištu
1107,Chapman,Guitars ML1 Modern Baritone Sage Green Satin Električna gitara,698 €,N/A,N/A,Nije na skladištu
1108,Epiphone,SG Custom Brunswick Blue Sparkle Električna gitara,738 €,860 €,- 14 %,Nije na skladištu
1109,Sire,Larry Carlton S3 Pink Električna gitara,386 €,N/A,N/A,Na putu
1110,Sire,Larry Carlton H7V Vintage Sunburst Jazz gitara,669 €,N/A,N/A,Na putu
1111,Gibson,Les Paul Modern Studio Wine Red Satin Električna gitara,2.189 €,N/A,N/A,Nije na skladištu
1112,PRS,John Mayer Silver Sky J2 Frost Električna gitara,2.839 €,N/A,N/A,Nije na skladištu
1113,Gibson,ES-335 Satin Vintage Burst Jazz gitara,2.489 €,2.639 €,- 6 %,Nije na skladištu
1114,SX,SSTLTD4 Sunflare Električna gitara,337 €,N/A,N/A,Na putu
1115,Fender,Squier Affinity Series Starcaster MN 3-Tone Sunburst Jazz gitara,337 €,N/A,N/A,Nije na skladištu
1116,Ibanez,RGD61ALA-MTR Midnight Tropical Rainforest Električna gitara,1.129 €,N/A,N/A,Na putu
1117,Sire,Larry Carlton T7 Fiesta Red Električna gitara,598 €,N/A,N/A,Na putu
1118,Fender,American Performer Stratocaster HSS RW Aubergine Električna gitara,1.519 €,N/A,N/A,Nije na skladištu
1119,Epiphone,Les Paul Studio LT Ebony Električna gitara,277 €,N/A,N/A,Nije na skladištu
1120,ESP,LTD H-1000 Evertune QM See Thru Purple Sunburst Električna gitara,1.699 €,N/A,N/A,Nije na skladištu
1121,Charvel,Pro-Mod DK24 HSS 2PT CM Satin Shell Pink Električna gitara,1.129 €,N/A,N/A,Nije na skladištu
1122,Chapman,Guitars ML3 Modern Ember Električna gitara,509 €,N/A,N/A,Nije na skladištu
1123,Fender,Squier FSR Classic Vibe Baritone Custom Telecaster Purple Sparkle Električna gitara,572 €,N/A,N/A,Nije na skladištu
1124,Fender,Squier FSR Classic Vibe '50s Telecaster MN 2-Color Sunburst Električna gitara,544 €,N/A,N/A,Nije na skladištu
1125,Gibson,Les Paul Modern Lite Gold Mist Električna gitara,1.259 €,N/A,N/A,Na putu
1126,Höfner,HCT-SH-0 Red Električna gitara,184 €,N/A,N/A,Nije na skladištu
1127,Chapman,Guitars ML1 Modern Slate Black Satin Električna gitara,617 €,N/A,N/A,Nije na skladištu
1128,Epiphone,Casino Worn Ebony Jazz gitara,561 €,569 €,N/A,Nije na skladištu
1129,Michael,Kelly CC50 Burl Burst Električna gitara,699 €,N/A,N/A,Na putu
1130,ESP,LTD Arrow-1000 Candy Apple Red Električna gitara,1.389 €,N/A,N/A,Nije na skladištu
1131,Schecter,SGR C-1 Electric Blue Električna gitara,330 €,N/A,N/A,Nije na skladištu
1132,Reverend,Guitars Charger HB Midnight Black Električna gitara,950 €,N/A,N/A,Nije na skladištu
1133,Fender,American Ultra Stratocaster MN Mocha Burst Električna gitara,2.469 €,N/A,N/A,Nije na skladištu
1134,Michael,Kelly 1963 Tobacco Sunburst Električna gitara,473 €,N/A,N/A,Nije na skladištu
1135,Fender,Squier FSR Classic Vibe '50s Telecaster MN Vintage Blonde Električna gitara,501 €,N/A,N/A,Nije na skladištu
1136,Sterling,by MusicMan SR30 Stealth Black Električna gitara,607 €,N/A,N/A,Nije na skladištu
1137,Chapman,Guitars ML1 X Deep Red Gloss Električna gitara,548 €,N/A,N/A,Nije na skladištu
1138,Reverend,Guitars Charger 290 Midnight Black Električna gitara,957 €,N/A,N/A,Nije na skladištu
1139,Sterling,by MusicMan CT30SSS Charcoal Frost Električna gitara,509 €,N/A,N/A,Nije na skladištu
1140,Chapman,Guitars ML3 Pro Modern Coral Pink Električna gitara,1.009 €,N/A,N/A,Nije na skladištu
1141,Gibson,Les Paul 70s Deluxe Wine Red Električna gitara,2.469 €,N/A,N/A,Nije na skladištu
1142,Sire,Larry Carlton S7 Champagne Gold Metallic Električna gitara,574 €,N/A,N/A,Na putu
1143,ESP,LTD Phoenix Snow White Električna gitara,1.209 €,N/A,N/A,Nije na skladištu
1144,Chapman,Guitars ML1 Hybrid Sarsen Stone Black Električna gitara,499 €,N/A,N/A,Nije na skladištu
1145,Jackson,Pro Series Signature Misha Mansoor Juggernaut ET6 Caramelized MN Chalk Gray Električna gitara,1.329 €,N/A,N/A,Nije na skladištu
1146,ESP,LTD EC1000QM SeeThru Black Cherry Električna gitara,1.399 €,N/A,N/A,Nije na skladištu
1147,Epiphone,Emperor Swingster Delta Blue Metallic Jazz gitara,846 €,N/A,N/A,Nije na skladištu
1148,Sire,Larry Carlton T3 Tobacco Sunburst Električna gitara,419 €,N/A,N/A,Na putu
1149,Charvel,Pro-Mod So-Cal Style 1 HH FR MN Gamera Black Električna gitara,1.009 €,N/A,N/A,Nije na skladištu
1150,Gretsch,G5220 Electromatic Jet BT Firestick Red Električna gitara,569 €,N/A,N/A,Nije na skladištu
1151,Chapman,Guitars ML1 Pro Modern Morpheus Purple Flip Električna gitara,1.139 €,N/A,N/A,Nije na skladištu
1152,Gretsch,G2655-P90 Streamliner Center Block Jr P90 IL Claret Burst Jazz gitara,595 €,N/A,N/A,Nije na skladištu
1153,Jackson,Concept Series Soloist SL Walnut HS Natural Električna gitara,1.869 €,N/A,N/A,Nije na skladištu
1154,Gretsch,G5425 Jet Club RW Silver Električna gitara,486 €,N/A,N/A,Nije na skladištu
1155,ESP,LTD H3-1000 QM See Thru Black Cherry Električna gitara,1.619 €,N/A,N/A,Nije na skladištu
1156,Chapman,Guitars ML1 Baritone Pro Modern Cyber Black Električna gitara,1.269 €,N/A,N/A,Nije na skladištu
1157,Fender,Jim Adkins JA-90 Telecaster Thinline IL Crimson Red Transparent Električna gitara,1.059 €,N/A,N/A,Nije na skladištu
1158,Chapman,Guitars ML1 Baritone Pro Modern Morpheus Purple Flip Električna gitara,1.179 €,N/A,N/A,Nije na skladištu
1159,Charvel,Pro-Mod DK24 HSH 2PT Caramelized MN Natural Električna gitara,1.119 €,N/A,N/A,Nije na skladištu
1160,Fender,American Performer Telecaster HUM RW Satin Surf Green Električna gitara,1.489 €,N/A,N/A,Nije na skladištu
1161,Legator,N7FS Ninja Solar Eclipse Električna gitara,604 €,N/A,N/A,Nije na skladištu
1162,Fender,Chrissie Hynde Telecaster RW Blue Metallic Električna gitara,1.519 €,N/A,N/A,Nije na skladištu
1163,Sire,Larry Carlton S3 Red Električna gitara,405 €,N/A,N/A,Na putu
1164,Ibanez,AF95-BS Brown Sunburst Jazz gitara,707 €,N/A,N/A,Nije na skladištu
1165,Jackson,JS32Q Dinky AH Transparent Black Električna gitara,435 €,440 €,N/A,Nije na skladištu
1166,Ibanez,JEMJRSP-YE Yellow Električna gitara,575 €,N/A,N/A,Nije na skladištu
1167,ESP,LTD Eclipse '87 NT Rainbow Crackle Električna gitara,1.199 €,N/A,N/A,Nije na skladištu
1168,ESP,LTD Viper-1000 Baritone Black Satin Električna gitara,1.439 €,N/A,N/A,Nije na skladištu
1169,Chapman,Guitars ML1 Modern Deep Blue Satin Električna gitara,551 €,N/A,N/A,Nije na skladištu
1170,Jackson,MJ Series Signature Misha Mansoor So-Cal 2PT Caramelized MN Daphne Blue Električna gitara,2.409 €,N/A,N/A,Nije na skladištu
1171,Chapman,Guitars ML3 Pro Modern Liquid Teal Električna gitara,1.219 €,N/A,N/A,Nije na skladištu
1172,Epiphone,ES-335 Bigsby Watermelon Red Jazz gitara,923 €,N/A,N/A,Nije na skladištu
1173,Chapman,Guitars ML1 Modern Baritone Slate Black Satin Električna gitara,745 €,N/A,N/A,Nije na skladištu
1174,Sire,Larry Carlton T3 Sonic Blue Električna gitara,390 €,N/A,N/A,Na putu
1175,Fender,American Vintage II 1977 Telecaster Custom MN Wine Električna gitara,2.279 €,N/A,N/A,Nije na skladištu
1176,Yamaha,Pacifica 612 VIIX Teal Green Metallic Električna gitara,1.029 €,N/A,N/A,Nije na skladištu
1177,Guild,Starfire I SC with Guild Vibrato Tailpiece Snowcrest White Jazz gitara,580 €,N/A,N/A,Nije na skladištu
1178,Schecter,Nick Johnston HSS Atomic Orange Električna gitara,1.109 €,N/A,N/A,Nije na skladištu
1179,Epiphone,Uptown Kat ES Ruby Red Metallic Jazz gitara,688 €,N/A,N/A,Nije na skladištu
1180,Chapman,Guitars ML3 Semi Hollow Pro Traditional Aventurine Green Sparkle Električna gitara,1.019 €,N/A,N/A,Nije na skladištu
1181,Fender,Squier FSR Classic Vibe '50s Esquire MN Butterscotch Blonde Električna gitara,492 €,N/A,N/A,Nije na skladištu
1182,Sire,Larry Carlton L7 Gold Top Električna gitara,579 €,N/A,N/A,Na putu
1183,Ibanez,RG7320EX-BKF Black Flat Električna gitara,692 €,N/A,N/A,Nije na skladištu
1184,Schecter,BANSHEE-6 SGR Walnut Satin Električna gitara,328 €,N/A,N/A,Nije na skladištu
1185,ESP,LTD Mirage Deluxe '87 Snow White Električna gitara,1.469 €,N/A,N/A,Nije na skladištu
1186,Gretsch,G2655 Streamliner CB JR IL Single Barrel Stain Jazz gitara,523 €,N/A,N/A,Nije na skladištu
1187,Chapman,Guitars ML1 Hybrid Abyss Električna gitara,498 €,N/A,N/A,Nije na skladištu
1188,Fender,American Professional II Stratocaster MN HSS 3-Tone Sunburst Električna gitara,2.229 €,N/A,N/A,Nije na skladištu
1189,Schecter,C-7 Pro Aqua Burst Električna gitara,937 €,N/A,N/A,Nije na skladištu
1190,Schecter,Kenny Hickey C-1 EX S Steel Green Električna gitara,1.379 €,N/A,N/A,Nije na skladištu
1191,Fender,Squier FSR Contemporary Stratocaster Special RMN Vintage White Električna gitara,518 €,N/A,N/A,Nije na skladištu
1192,Legator,N7FS Ninja Lunar Eclipse Električna gitara,609 €,N/A,N/A,Nije na skladištu
1193,Chapman,Guitars Ghost Fret Pro Satin Blue Burst Električna gitara,1.349 €,N/A,N/A,Nije na skladištu
1194,G&L,Legacy MP Black Gloss Električna gitara,624 €,N/A,N/A,Nije na skladištu
1195,Epiphone,1959 Les Paul Standard Iced Tea Električna gitara,1.359 €,N/A,N/A,Nije na skladištu
1196,Gibson,Les Paul Standard 60s Figured Top Blueberry Burst Električna gitara,3.109 €,N/A,N/A,Nije na skladištu
1197,EVH,Striped Series 78 Eruption Relic Relic White with Black Stripes Relic Električna gitara,1.279 €,N/A,N/A,Nije na skladištu
1198,Schecter,Damien-6 Satin Black Električna gitara,897 €,N/A,N/A,Nije na skladištu
1199,Jackson,X Series Soloist SL3X DX Matte Army Drab Električna gitara,777 €,792 €,N/A,Nije na skladištu
1200,Reverend,Guitars Jetstream HB Midnight Black Električna gitara,1.009 €,N/A,N/A,Nije na skladištu
1201,Gibson,ES-335 Figured Iced Tea Jazz gitara,3.333 €,3.539 €,- 6 %,Nije na skladištu
1202,Fender,Player II Series Telecaster RW Aged Cherry Burst Električna gitara,888 €,N/A,N/A,Nije na skladištu
1203,Henry's,ST-1 Python Blue Relic Električna gitara,719 €,N/A,N/A,Nije na skladištu
1204,Kramer,NightSwan Jet Black Metallic Električna gitara,779 €,N/A,N/A,Nije na skladištu
1205,Fender,Player Lead II MN Black Električna gitara,719 €,N/A,N/A,Nije na skladištu
1206,PRS,SE Custom 24-08 Turquiose Električna gitara,1.299 €,N/A,N/A,Nije na skladištu
1207,G&L,Legacy MP Shoreline Gold Električna gitara,624 €,N/A,N/A,Nije na skladištu
1208,Charvel,Pro-Mod San Dimas Style 1 HH FR EB Miami Blue Električna gitara (Skoro novo),"913,61 €","1.025,05 €",- 11 %,Nije na skladištu
1209,ESP,ESP E-II FRX BLKS BLACK SATIN Black Satin Električna gitara,3.079 €,N/A,N/A,Nije na skladištu
1210,Chapman,Guitars ML3 Traditional Gloss Black Električna gitara,519 €,N/A,N/A,Nije na skladištu
1211,Fender,Vintera II 70s Telecaster Deluxe MN Surf Green Električna gitara,1.199 €,N/A,N/A,Nije na skladištu
1212,PRS,Singlecut McCarty 594 Turquiose Električna gitara,1.299 €,N/A,N/A,Nije na skladištu
1213,Sterling,by MusicMan Mariposa Dorado Green Električna gitara,968 €,N/A,N/A,Na putu
1214,G&L,Tribute ASAT Classic Emerald Blue Električna gitara,624 €,N/A,N/A,Nije na skladištu
1215,Jackson,X Series Soloist SLX DX Tiger Jungle Camo Električna gitara,876 €,N/A,N/A,Nije na skladištu
1216,Gibson,Les Paul Studio (Black Trim) Blueberry Burst Električna gitara,1.879 €,N/A,N/A,Nije na skladištu
1217,G&L,Tribute ASAT Classic Butterscotch Blonde Električna gitara,676 €,688 €,N/A,Nije na skladištu
1218,PRS,SE 245 VS Vintage Sunburst Električna gitara,910 €,N/A,N/A,Nije na skladištu
1219,Schecter,SGR Solo-II Metallic Red Električna gitara,351 €,N/A,N/A,Nije na skladištu
1220,ESP,E-II Eclipse Full Thickness Tobacco Sunburst Električna gitara,2.769 €,N/A,N/A,Nije na skladištu
1221,Fender,Player II Series Telecaster RW Transparent Cherry Električna gitara,888 €,N/A,N/A,Na putu
1222,Reverend,Guitars Descent RA Midnight Black Električna gitara,1.239 €,N/A,N/A,Nije na skladištu
1223,Schecter,S-1 SGR Midnight Satin Black Električna gitara,339 €,N/A,N/A,Nije na skladištu
1224,Epiphone,Les Paul Standard 60s Purple Sparkle Električna gitara,923 €,N/A,N/A,Nije na skladištu
1225,Fender,FSR American Professional II Telecaster Thinline MN Transparent Shell Pink Električna gitara,2.409 €,N/A,N/A,Nije na skladištu
1226,Fender,Player II Series Telecaster MN Coral Red Električna gitara,877 €,N/A,N/A,Nije na skladištu
1227,Epiphone,Wilshire P-90s Ebony Električna gitara,519 €,N/A,N/A,Nije na skladištu
1228,Guild,Aristocrat P90 Vintage Sunburst Električna gitara,978 €,N/A,N/A,Nije na skladištu
1229,Epiphone,Coronet Ebony Električna gitara,596 €,N/A,N/A,Nije na skladištu
1230,Guild,Surfliner HH Shoreline Mist Električna gitara,541 €,N/A,N/A,Nije na skladištu
1231,Schecter,S-1 SGR Gloss Black Električna gitara,339 €,N/A,N/A,Nije na skladištu
1232,Schecter,Damien-7 Left Handed Satin Black Električna gitara,700 €,N/A,N/A,Nije na skladištu
1233,Fender,American Ultra II Stratocaster EB Texas Tea Električna gitara,"2.331,42 €",N/A,N/A,Na putu
1234,Ibanez,GRGR221PA-AQB Aqua Burst Električna gitara,341 €,N/A,N/A,Na putu
1235,Jackson,JS32 DKA-M Dinky Snow White Električna gitara,436 €,N/A,N/A,Na putu
1236,Encore,E60 Blaster Pack Gloss Black Električna gitara,218 €,N/A,N/A,Na putu
1237,Ibanez,SA360NQM-SPB Sapphire Blue Električna gitara,596 €,N/A,N/A,Na putu
1238,Fender,Squier Affinity Series Stratocaster Lake Placid Blue Električna gitara,307 €,N/A,N/A,Na putu
1239,ABX,30 SET 3-Tone Sunburst Električna gitara,230 €,N/A,N/A,Na putu
1240,Ibanez,GRX70QA-TBB Transparent Blue Burst Električna gitara,258 €,N/A,N/A,Na putu
1241,Ibanez,GRGR330EX-BKF Black Flat Električna gitara,358 €,N/A,N/A,Na putu
1242,ESP,LTD KH-202 LH Kirk Hammett Black Električna gitara,752 €,N/A,N/A,Na putu
1243,Jackson,JS32 Warrior AH Black with White Bevels Električna gitara,434 €,N/A,N/A,Na putu
1244,Gibson,70s Flying V Classic White Električna gitara,2.589 €,N/A,N/A,Na putu
1245,Fender,Squier Classic Vibe 60s Stratocaster IL Candy Apple Red Električna gitara,462 €,N/A,N/A,Na putu
1246,Ibanez,AZES40-PRB Purist Blue Električna gitara,340 €,N/A,N/A,Na putu
1247,Yamaha,Pacifica 112J MKII Red Metallic Električna gitara,286 €,N/A,N/A,Na putu
1248,ESP,LTD EC-256FM Dark Brown Sunburst Električna gitara,547 €,N/A,N/A,Na putu
1249,Yamaha,RSP20X Rusty Burst Charcoal Električna gitara,1.929 €,N/A,N/A,Na putu
1250,Fender,Squier Classic Vibe 50s Stratocaster MN Black Električna gitara,450 €,N/A,N/A,Na putu
1251,Jackson,Pro Series King V KV EB Gloss Black Električna gitara,1.009 €,N/A,N/A,Na putu
1252,Fender,Player Plus Stratocaster MN Olympic Pearl Električna gitara,1.029 €,N/A,N/A,Na putu
1253,Ibanez,RG421EX-BKF Black Flat Električna gitara,434 €,N/A,N/A,Na putu
1254,Jackson,JS22 Monarkh AH Satin Black Električna gitara,250 €,N/A,N/A,Na putu
1255,Encore,E60 Blaster Pack Gloss Red Finish Električna gitara,196 €,N/A,N/A,Na putu
1256,Ibanez,GRX40-BKN Black Night Električna gitara,220 €,N/A,N/A,Na putu
1257,PRS,SE Mark Holcomb Holcomb Blue Burst Električna gitara,1.179 €,N/A,N/A,Na putu
1258,Epiphone,ES-339 Vintage Sunburst Jazz gitara,582 €,N/A,N/A,Na putu
1259,Fender,Squier Affinity Series Stratocaster FMT Sienna Sunburst Električna gitara,304 €,N/A,N/A,Na putu
1260,Yamaha,RSS20 Flash Green Električna gitara,822 €,N/A,N/A,Na putu
1261,ABX,20 SET Red Električna gitara,220 €,N/A,N/A,Na putu
1262,Ibanez,RGRT421-WK Weathered Black Električna gitara,522 €,N/A,N/A,Na putu
1263,ESP,LTD M-200FM See Thru Red Električna gitara,669 €,N/A,N/A,Na putu
1264,Ibanez,RGA42EX-BAM Black Aurora Burst Matte Električna gitara,433 €,N/A,N/A,Na putu
1265,Ibanez,JEM7VP-WH White Električna gitara,1.859 €,N/A,N/A,Na putu
1266,Fender,Player Plus Stratocaster MN 3-Color Sunburst Električna gitara,1.069 €,N/A,N/A,Na putu
1267,Yamaha,Pacifica 120H Black Električna gitara,384 €,N/A,N/A,Na putu
1268,Encore,E90 Blaster Pack Gloss Black Električna gitara,277 €,N/A,N/A,Na putu
1269,Gretsch,G5230T Electromatic JET FT Black Električna gitara,589 €,N/A,N/A,Na putu
1270,Gibson,1968 Les Paul Custom Reissue Gloss Ebony Električna gitara,6.159 €,N/A,N/A,Na putu
1271,Jackson,JS22 Dinky Arch Top AH Metallic Blue Električna gitara,265 €,N/A,N/A,Na putu
1272,Yamaha,RSE20L Swift Blue Električna gitara,520 €,N/A,N/A,Na putu
1273,Fender,Squier Sonic Telecaster LRL California Blue Električna gitara,188 €,N/A,N/A,Na putu
1274,Ibanez,GRG320FA-TBS Transparent Blue Sunburst Električna gitara,403 €,N/A,N/A,Na putu
1275,Fender,Vintera II 50s Nocaster MN Blackguard Blonde Električna gitara,1.090 €,N/A,N/A,Na putu
1276,Fender,Kurt Cobain Jaguar RW 3-Tone Sunburst Električna gitara,1.609 €,N/A,N/A,Na putu
