ID,Guitar Name,Model,Price,Old Price,Discount,Status
1277,Fender,Player Plus Telecaster MN 3-Color Sunburst Električna gitara,1.089 €,N/A,N/A,Na putu
1278,Jackson,Pro Series Mark Heylmun Rhoads RR24-7 Lux Električna gitara,1.190 €,N/A,N/A,Na putu
1279,Ibanez,RGD71ALMS-BAM Black Aurora Burst Matte Električna gitara,1.090 €,N/A,N/A,Na putu
1280,Fender,American Professional II Stratocaster RW HSS Dark Night Električna gitara,2.019 €,N/A,N/A,Na putu
1281,Fender,American Ultra Telecaster RW Arctic Pearl Električna gitara,2.549 €,N/A,N/A,Na putu
1282,Ibanez,GRG7221QA-TKS Transparent Black Sunburst Električna gitara,349 €,N/A,N/A,Na putu
1283,Jackson,Pro Series Dave Davidson Warrior WR7 MAH Walnut Stain Električna gitara,1.679 €,N/A,N/A,Na putu
1284,Encore,E60 Blaster Gloss Red Finish Električna gitara,121 €,N/A,N/A,Na putu
1285,Ibanez,RGT1220PB-ABS Antique Brown Stained Električna gitara,1.435 €,N/A,N/A,Na putu
1286,Cort,G250 Black Električna gitara,277 €,N/A,N/A,Na putu
1287,Fender,Player Plus Telecaster MN Butterscotch Blonde Električna gitara,1.039 €,N/A,N/A,Na putu
1288,Ibanez,RG421PB-CHF Caribbean Shoreline Flat Električna gitara,443 €,N/A,N/A,Na putu
1289,Fender,Player Plus Stratocaster HSS MN 3-Color Sunburst Električna gitara,1.099 €,N/A,N/A,Na putu
1290,Fender,American Ultra II Stratocaster HSS MN Sinister Red Električna gitara,2.490 €,N/A,N/A,Na putu
1291,Jackson,JS12 Dinky AH Metallic Blue Električna gitara,228 €,N/A,N/A,Na putu
1292,Höfner,HCT-SH-0 Blue Električna gitara,"154,84 €",N/A,N/A,Na putu
1293,Jackson,Pro Plus Series DKA EB Oxblood Električna gitara,1.035 €,N/A,N/A,Na putu
1294,Jackson,S Series Monarkh SC JS22 AH Tobacco Burst Električna gitara,306 €,N/A,N/A,Na putu
1295,Jackson,X Series Rhoads RRX24 Battleship Gray Električna gitara,827 €,N/A,N/A,Na putu
1296,Fender,American Performer Telecaster RW Satin Sonic Blue Električna gitara,1.439 €,N/A,N/A,Na putu
1297,ESP,LTD Arrow-1000NT Charcoal Metallic Satin Električna gitara,1.359 €,N/A,N/A,Na putu
1298,Ibanez,RGDMS8-CSM Classic Silver Matte Električna gitara,1.169 €,N/A,N/A,Na putu
1299,Encore,E60 Blaster Pack Sunburst Električna gitara,204 €,N/A,N/A,Na putu
1300,PRS,SE Singlecut Mccarty 594 Standard McCarty Tobacco Sunburst Električna gitara,888 €,N/A,N/A,Na putu
1301,Fender,Player II Series Stratocaster RW Coral Red Električna gitara,"798,70 €",N/A,N/A,Na putu
1302,Gibson,Les Paul Modern Lite Inverness Green Električna gitara,1.349 €,N/A,N/A,Na putu
1303,Jackson,X Series Signature Adrian Smith SDXQ MN Transparent Green Električna gitara,607 €,N/A,N/A,Na putu
1304,Ibanez,PSM10-BK Black Električna gitara,349 €,N/A,N/A,Na putu
1305,Fender,Player Plus Nashville Telecaster PF Sienna Sunburst Električna gitara,1.049 €,N/A,N/A,Na putu
1306,Gretsch,G5260 Electromatic Jet Baritone LRL Imperial Stain Električna gitara,579 €,N/A,N/A,Na putu
1307,ESP,LTD M-200DX Purple Burst Električna gitara,525 €,N/A,N/A,Na putu
1308,Jackson,Pro Series Signature Jeff Loomis Soloist SL7 Black Električna gitara,1.509 €,N/A,N/A,Na putu
1309,Ibanez,GRG320FA-TKS Transparent Black Sunburst Električna gitara,386 €,N/A,N/A,Na putu
1310,Jackson,X Series Rhoads RRX24 IL Red with Black Bevels Električna gitara,814 €,N/A,N/A,Na putu
1311,Fender,Squier Classic Vibe Starcaster MN Natural Jazz gitara,484 €,N/A,N/A,Na putu
1312,Ibanez,RG470DX-TMN Tokyo Midnight Električna gitara,578 €,N/A,N/A,Na putu
1313,Fender,American Professional II Telecaster MN Roasted Pine Električna gitara,2.029 €,N/A,N/A,Na putu
1314,Ibanez,SA260FM-TGB Transparent Gray Burst Električna gitara,432 €,N/A,N/A,Na putu
1315,Ibanez,RG7420EX-BKF Black Flat Električna gitara,698 €,N/A,N/A,Na putu
1316,Schecter,C-1 Exotic Ebony NS Natural Matte Električna gitara,1.149 €,N/A,N/A,Na putu
1317,Ibanez,GRG121DXL-WNF Walnut Flat Električna gitara,237 €,N/A,N/A,Na putu
1318,Schecter,Reaper-6 FR Inferno Burst Električna gitara,1.159 €,1.249 €,- 7 %,Na putu
1319,EVH,Wolfgang WG Standard QM 3-Color Sunburst Električna gitara,686 €,N/A,N/A,Na putu
1320,EVH,Stripe Series Black with Yellow Stripes Električna gitara,991 €,N/A,N/A,Na putu
1321,Ibanez,RG470DX-SFM Sea Foam Green Matte Električna gitara,533 €,N/A,N/A,Na putu
1322,Fender,American Performer Telecaster HUM MN 3-Color Sunburst Električna gitara,1.489 €,N/A,N/A,Na putu
1323,Ibanez,RG9PB-TGF Transparent Gray Flat Električna gitara,1.279 €,N/A,N/A,Na putu
1324,Jackson,American Series Virtuoso HT EB Black Satin Električna gitara,1.959 €,N/A,N/A,Na putu
1325,Ibanez,GRG170DX-BKN Black Night Električna gitara,295 €,N/A,N/A,Na putu
1326,Gibson,SG Standard Classic White Električna gitara,1.629 €,N/A,N/A,Na putu
1327,ESP,LTD EC-1000 Baritone Charcoal Metallic Satin Električna gitara,1.444 €,N/A,N/A,Na putu
1328,Fender,Squier Affinity Series Starcaster Deluxe MN Sienna Sunburst Jazz gitara,352 €,N/A,N/A,Na putu
1329,Ibanez,AF55-TF Tobacco Flat Jazz gitara,414 €,N/A,N/A,Na putu
1330,ESP,LTD Horizon CTM '87 Black Električna gitara,1.635 €,N/A,N/A,Na putu
1331,Fender,Player II Series Stratocaster RW Transparent Cherry Burst Električna gitara,"870,24 €",N/A,N/A,Na putu
1332,Jackson,JS Series Dinky Arch Top JS24 DKAM Caramelized MN Red Satin Električna gitara,369 €,N/A,N/A,Na putu
1333,Fender,Player II Series Stratocaster HSS MN Transparent Mocha Burst Električna gitara,"859,46 €",N/A,N/A,Na putu
1334,Ibanez,XPTB620-BKF Black Flat Električna gitara,1.219 €,N/A,N/A,Na putu
1335,Fender,Player II Series Telecaster RW White Blonde Električna gitara,873 €,N/A,N/A,Na putu
1336,Fender,Player II Series Stratocaster HSS RW White Blonde Električna gitara,"880,04 €",N/A,N/A,Na putu
1337,Fender,Player II Series Telecaster LH RW Polar White Električna gitara,815 €,N/A,N/A,Na putu
1338,ESP,LTD M-1001 Charcoal Metallic Satin Električna gitara,1.590 €,N/A,N/A,Na putu
1339,Yamaha,RSE20 Swift Blue Električna gitara,524 €,N/A,N/A,Na putu
1340,Ibanez,GRGM21-WH White Električna gitara,243 €,N/A,N/A,Na putu
1341,EVH,Striped Series 5150 MN Red Black and White Stripes Električna gitara,1.279 €,N/A,N/A,Na putu
1342,Charvel,Pro-Mod DK24 HSS 2PT Caramelized MN Snow White Električna gitara,1.129 €,N/A,N/A,Na putu
1343,Ibanez,RG421-MOL Mahogany Oil Električna gitara,385 €,N/A,N/A,Na putu
1344,Ibanez,GRX40-CA Candy Apple Električna gitara,233 €,N/A,N/A,Na putu
1345,Fender,Ultra Luxe Stratocaster FR HSS MN Silverburst Električna gitara,2.544 €,N/A,N/A,Na putu
1346,SX,STL50 2-Tone Sunburst Električna gitara,153 €,N/A,N/A,Na putu
1347,Gibson,ES-335 Vintage Burst Jazz gitara,"2.939,02 €",N/A,N/A,Na putu
1348,Gibson,ES-335 Vintage Ebony Jazz gitara,"2.929,22 €",N/A,N/A,Na putu
1349,Jackson,JS Series Dinky Arch Top JS22Q-7 DKA HT AH Transparent Black Burst Električna gitara,335 €,N/A,N/A,Na putu
1350,Ibanez,RGR652AHBF-WK Weathered Black Električna gitara,1.509 €,N/A,N/A,Na putu
1351,Jackson,Pro Plus Series Soloist SLA3Q EB Amber Tiger Eye Električna gitara,1.390 €,N/A,N/A,Na putu
1352,Epiphone,"Jerry Cantrell ""Wino"" Les Paul Custom Dark Wine Red Električna gitara",891 €,N/A,N/A,Na putu
1353,Jackson,RRT-3 Rhoads Pro Series Natural Električna gitara,980 €,N/A,N/A,Na putu
1354,Ibanez,RGA42FM-BLF Blue Lagoon Burst Flat Električna gitara,434 €,N/A,N/A,Na putu
1355,Jackson,Pro RRT-5 Rhoads Gloss Black Električna gitara,"916,30 €",N/A,N/A,Na putu
1356,Ibanez,RG7421-WNF Walnut Flat Električna gitara,559 €,567 €,N/A,Na putu
1357,Ibanez,AS53-TKF Transparent Black Flat Jazz gitara,388 €,N/A,N/A,Na putu
1358,Epiphone,Les Paul Special-II Ebony Električna gitara,299 €,N/A,N/A,Na putu
1359,Ibanez,PGMM31-WH White Električna gitara,257 €,N/A,N/A,Na putu
1360,Cort,KX 307MS Open Pore Mahogany Električna gitara,438 €,N/A,N/A,Na putu
1361,Ibanez,GRG140-SB Sunburst Električna gitara,295 €,N/A,N/A,Na putu
1362,Ibanez,JIVAJR-DSE Deep Sea Blonde Električna gitara,833 €,N/A,N/A,Na putu
1363,Cort,CR200 Gold Top Električna gitara,453 €,N/A,N/A,Na putu
1364,Epiphone,1963 Les Paul SG Custom Classic White Električna gitara,1.519 €,N/A,N/A,Na putu
1365,Jackson,JS32L Dinky DKA AH Bright Blue Električna gitara,379 €,N/A,N/A,Na putu
1366,Ibanez,JEMJR-BK Black Električna gitara,584 €,N/A,N/A,Na putu
1367,Ibanez,RG420EX-BKF Black Flat Električna gitara,567 €,N/A,N/A,Na putu
1368,Schecter,SGR-C1 Metallic Red Električna gitara,327 €,N/A,N/A,Na putu
1369,Gibson,ES-345 Sixties Cherry Jazz gitara,"3.233,02 €",N/A,N/A,Na putu
1370,Gibson,Les Paul Supreme Wine Red Električna gitara,"3.625,02 €",N/A,N/A,Na putu
1371,Ibanez,AZES40-MGR Mint Green Električna gitara,320 €,N/A,N/A,Na putu
1372,Fender,American Performer Telecaster MN Honey Burst Električna gitara,1.469 €,N/A,N/A,Na putu
1373,Sire,Larry Carlton H7 See Thru Red Jazz gitara,689 €,N/A,N/A,Na putu
1374,Gibson,Les Paul Classic Honeyburst Električna gitara,2.299 €,2.349 €,N/A,Na putu
1375,Jackson,Pro Series Gus G. Star Ivory Električna gitara,1.119 €,N/A,N/A,Na putu
1376,Yamaha,Pacifica Professional SWH Shell White Električna gitara,2.107 €,2.149 €,N/A,Na putu
1377,PRS,SE Custom 24 Charcoal Električna gitara,875 €,N/A,N/A,Na putu
1378,Ibanez,RG7421EX-BKF Black Flat Električna gitara,541 €,N/A,N/A,Na putu
1379,Höfner,Shorty Deluxe Black Električna gitara,"184,24 €",N/A,N/A,Na putu
1380,Cort,KX707 Evertune Open Pore Black Električna gitara,1.039 €,N/A,N/A,Na putu
1381,Ibanez,AZES40-TUN Volfram Električna gitara,321 €,N/A,N/A,Na putu
1382,Sire,Larry Carlton H7 White Jazz gitara,641 €,N/A,N/A,Na putu
1383,Epiphone,1959 Les Paul Standard Aged Dark Cherry Burst Električna gitara,959 €,N/A,N/A,Na putu
1384,Ibanez,S770-CZM Cosmic Blue Frozen Matte Električna gitara,933 €,N/A,N/A,Na putu
1385,Michael,Kelly 1953 Caramel Burst Električna gitara,484 €,N/A,N/A,Na putu
1386,Michael,Kelly Patriot Decree Električna gitara,461 €,N/A,N/A,Na putu
1387,Guild,Surfliner Deluxe Evergreen Metallic Električna gitara,"696,78 €",750 €,- 7 %,Na putu
1388,Höfner,HCT-SH-0 Black Električna gitara,"154,84 €",N/A,N/A,Na putu
1389,Cort,KX300 EBG Etched Black Gold Električna gitara,519 €,N/A,N/A,Na putu
1390,Cort,X100 Open Pore Black Cherry Burst Električna gitara,199 €,N/A,N/A,Na putu
1391,Guild,Surfliner HH Canyon Dusk Električna gitara,542 €,N/A,N/A,Na putu
1392,Sire,Larry Carlton L7 Black Električna gitara,624 €,N/A,N/A,Na putu
1393,Encore,E90 Blaster Tobacco Sunburst Električna gitara,181 €,N/A,N/A,Na putu
1394,Fender,Player II Series Stratocaster HSS RW Transparent Cherry Burst Električna gitara,"880,04 €",N/A,N/A,Na putu
1395,Cort,X300 Flip Purple Električna gitara,551 €,N/A,N/A,Na putu
1396,Gibson,1963 SG Special Reissue Lightning Bar VOS Cherry Red Električna gitara,"3.560,10 €",N/A,N/A,Na putu
1397,Ibanez,RGT1221PB-SWL Stained Wine Red Električna gitara,1.390 €,N/A,N/A,Na putu
1398,Höfner,Shorty Deluxe Red Električna gitara,"173,46 €",N/A,N/A,Na putu
1399,Gibson,Les Paul Modern Studio Worn White Električna gitara,"2.057,02 €",2.289 €,- 10 %,Na putu
1400,Cort,KX 700 EVERTUNE Open Pore Black Električna gitara,1.099 €,N/A,N/A,Na putu
1401,Cort,G200 Pastel Pink Električna gitara,285 €,N/A,N/A,Na putu
1402,Dean,Guitars Thoroughbred X Quilt Maple Električna gitara,409 €,N/A,N/A,Na putu
1403,ESP,LTD TE-201 LH Black Satin Električna gitara,538 €,N/A,N/A,Na putu
1404,Gibson,Les Paul Modern Figured Cobalt Burst Električna gitara,"2.841,02 €",N/A,N/A,Na putu
1405,Dean,Guitars Exile Select Floyd Fluence Black Satin Električna gitara,981 €,N/A,N/A,Na putu
1406,Cort,KX 307MS Black Električna gitara,430 €,N/A,N/A,Na putu
1407,Gibson,Firebird Custom Gloss Ebony Električna gitara,5.739 €,N/A,N/A,Na putu
1408,Gibson,Les Paul Custom Gloss Ebony Električna gitara,5.609 €,N/A,N/A,Na putu
1409,Encore,E6 Gloss Black Električna gitara,181 €,N/A,N/A,Na putu
1410,The,Loar LH-309 Vintage Sunburst Jazz gitara,698 €,N/A,N/A,Na putu
1411,Vintage,V100PBB Gloss Black Električna gitara,643 €,N/A,N/A,Na putu
1412,The,Loar LH-600 Vintage Sunburst Jazz gitara,1.039 €,N/A,N/A,Na putu
1413,G&L,Comanche Olympic White Električna gitara,735 €,N/A,N/A,Na putu
1414,Schecter,OMEN EXTREME 6 Black Cherry Električna gitara,645 €,N/A,N/A,Na putu
1415,Michael,Kelly 54 Open Pore Faded Black Električna gitara,468 €,N/A,N/A,Na putu
1416,Epiphone,Extura Prophecy Aged Bengal Tiger Burst Električna gitara,1.149 €,N/A,N/A,Na putu
1417,Gibson,80s Explorer Ebony Električna gitara,2.039 €,N/A,N/A,Na putu
1418,Jackson,Pro Plus XT Warrior WR HT6 Baritone EB Satin Black Električna gitara,1.249 €,N/A,N/A,Na putu
1419,Epiphone,Flying V Prophecy Aged Jet Black Metallic Električna gitara,1.099 €,N/A,N/A,Na putu
1420,Danelectro,59X Dark Red Električna gitara,759 €,N/A,N/A,Na putu
1421,Epiphone,Extura Prophecy Jet Black Metallic Električna gitara,1.149 €,N/A,N/A,Na putu
1422,Michael,Kelly 53 Open Pore Tobaccoburst Električna gitara,468 €,N/A,N/A,Na putu
1423,Gibson,SG Standard '61 Stop Bar Classic White Električna gitara,"1.857,10 €",2.079 €,- 11 %,Na putu
1424,Gibson,Les Paul Standard 50s Figured Top 60s Cherry Električna gitara,2.449 €,N/A,N/A,Na putu
1425,Gibson,1964 SG Standard Reissue w/ Maestro Ultra Light Aged Cherry Red Električna gitara,5.209 €,N/A,N/A,Na putu
1426,Epiphone,Alex Lifeson Les Paul Custom Axcess Ruby Električna gitara,1.429 €,N/A,N/A,Na putu
1427,Gibson,SG Standard '61 Stop Bar TV Yellow Električna gitara,2.079 €,N/A,N/A,Na putu
1428,Gibson,Les Paul Standard 60s Plain Top Ebony Električna gitara,"2.488,22 €",N/A,N/A,Na putu
1429,Epiphone,Les Paul Prophecy Aged Bengal Tiger Burst Električna gitara,1.249 €,N/A,N/A,Na putu
1430,Epiphone,SG Prophecy Aged Bengal Tiger Burst Električna gitara,1.145 €,N/A,N/A,Na putu
1431,Gibson,Les Paul Junior Vintage Tobacco Burst Električna gitara,1.669 €,N/A,N/A,Na putu
1432,Gibson,SG Standard '61 Stop Bar Vintage Cherry Električna gitara,2.079 €,N/A,N/A,Na putu
1433,Gibson,Les Paul Standard 60s Bourbon Burst Električna gitara,3.079 €,N/A,N/A,Na putu
1434,Ibanez,GRG121DX Black Flat SET Black Flat Električna gitara,335 €,N/A,N/A,Samo po narudžbi
1435,Epiphone,SG Standard '61 SET Vintage Cherry Električna gitara,597 €,N/A,N/A,Samo po narudžbi
1436,Epiphone,Les Paul Classic SET Ebony Električna gitara,778 €,N/A,N/A,Samo po narudžbi
1437,Epiphone,SG Special P-90 SET Sparkling Burgundy Električna gitara,479 €,N/A,N/A,Samo po narudžbi
1438,Pasadena,CL103 Red Električna gitara,303 €,N/A,N/A,Samo po narudžbi
1439,SX,SST/ASH/R SET Rosewood-Natural Električna gitara,308 €,N/A,N/A,Samo po narudžbi
1440,ABX,10 SET Black Električna gitara,232 €,N/A,N/A,Samo po narudžbi
1441,Fender,Player II Series Stratocaster MN Black Električna gitara,811 €,N/A,N/A,Samo po narudžbi
1442,Schecter,ZV-H6LLYW66D White Električna gitara,1.579 €,N/A,N/A,Samo po narudžbi
1443,D'Angelico,Premier SS Black Flake Jazz gitara,749 €,N/A,N/A,Samo po narudžbi
1444,Epiphone,Les Paul Classic Honey Burst Električna gitara,618 €,N/A,N/A,Samo po narudžbi
1445,Epiphone,Les Paul Classic SET Honey Burst Električna gitara,718 €,N/A,N/A,Samo po narudžbi
1446,SX,Standard TL SET Natural Električna gitara,339 €,N/A,N/A,Samo po narudžbi
1447,Epiphone,Riviera SET Sparkling Burgundy Jazz gitara,748 €,N/A,N/A,Samo po narudžbi
1448,SX,EF3D-DS SET Desert Sunburst Električna gitara,355 €,N/A,N/A,Samo po narudžbi
1449,Epiphone,Flying V Ebony Električna gitara,739 €,N/A,N/A,Samo po narudžbi
1450,Jackson,Adrian Smith Signature SDX Snow White Električna gitara,602 €,N/A,N/A,Na zalihi kod dobavljača
1451,Cort,CR250 Antique Amber Električna gitara,485 €,N/A,N/A,Samo po narudžbi
1452,Epiphone,Les Paul Studio Ebony Električna gitara,565 €,N/A,N/A,Samo po narudžbi
1453,SX,Vintage ST 57 Vintage White Električna gitara,218 €,N/A,N/A,Samo po narudžbi
1454,Fender,Player Series Stratocaster HSH PF Tobacco Burst Električna gitara,826 €,N/A,N/A,Samo po narudžbi
1455,Fender,Squier Classic Vibe 50s Stratocaster MN Fiesta Red Električna gitara,392 €,N/A,N/A,Samo po narudžbi
1456,Epiphone,Les Paul Standard '50s Vintage Sunburst Električna gitara,617 €,N/A,N/A,Samo po narudžbi
1457,Jackson,X Series Rhoads RRX24 IL BLK with YLW Bevels Električna gitara,812 €,N/A,N/A,Samo po narudžbi
1458,Epiphone,Casino Vintage Sunburst Jazz gitara,765 €,N/A,N/A,Samo po narudžbi
1459,ESP,LTD Alexi Ripped Sawtooth Purple Fade Satin Električna gitara,2.199 €,N/A,N/A,Na zalihi kod dobavljača
1460,Ibanez,AM53-SRF Sunburst Red Flat Jazz gitara,387 €,N/A,N/A,Samo po narudžbi
1461,Ibanez,SEW761FM-NTF Natural Električna gitara,874 €,N/A,N/A,Samo po narudžbi
1462,Yamaha,Pacifica 311 H Yellow Natural Satin Električna gitara,462 €,N/A,N/A,Samo po narudžbi
1463,Cort,G250 Tobacco Burst Električna gitara,312 €,N/A,N/A,Samo po narudžbi
1464,ESP,LTD AA-1 BLKS Black Satin Električna gitara,1.729 €,N/A,N/A,Samo po narudžbi
1465,Yamaha,SA 2200 VS WC Violin Sunburst Jazz gitara,2.529 €,N/A,N/A,Samo po narudžbi
1466,Yamaha,Pacifica 120H Yellow Natural Satin Električna gitara,384 €,N/A,N/A,Samo po narudžbi
1467,ESP,LTD EC-1000 FR Black Satin Električna gitara,1.469 €,N/A,N/A,Na zalihi kod dobavljača
1468,Fender,Squier Classic Vibe '70s Telecaster Custom MN 3-Tone Sunburst Električna gitara,464 €,N/A,N/A,Samo po narudžbi
1469,Fender,Squier Classic Vibe 50s Telecaster MN Butterscotch Blonde Električna gitara,446 €,N/A,N/A,Samo po narudžbi
1470,Ibanez,SA260FM-VLS Violin Sunburst Električna gitara,447 €,N/A,N/A,Samo po narudžbi
1471,Hagstrom,Fantomen Black Električna gitara,798 €,N/A,N/A,Samo po narudžbi
1472,Fender,Player II Series Stratocaster RW White Blonde Električna gitara,798 €,N/A,N/A,Samo po narudžbi
1473,PRS,SE Lefty Custom 24 Violin Top Carve Black Gold Sunburst Električna gitara,955 €,N/A,N/A,Na zalihi kod dobavljača
1474,Duesenberg,Fantom S Black Električna gitara,3.459 €,N/A,N/A,Samo po narudžbi
1475,Ibanez,AF75G Artcore Black Flat Jazz gitara,606 €,N/A,N/A,Samo po narudžbi
1476,Epiphone,Matt Heafy Les Paul Custom Origins Ebony Električna gitara,1.099 €,N/A,N/A,Samo po narudžbi
1477,Epiphone,Les Paul Custom Figured Transparent Red Električna gitara,840 €,N/A,N/A,Samo po narudžbi
1478,Schecter,C-7 Pro Aurora Burst Električna gitara,936 €,N/A,N/A,Samo po narudžbi
1479,G&L,Comanche MP Emerald Blue Metallic Električna gitara,804 €,N/A,N/A,Na zalihi kod dobavljača
1480,Gibson,1956 Les Paul Goldtop Reissue Ultra Light Aged Double Gold Električna gitara,5.299 €,N/A,N/A,Samo po narudžbi
1481,Gretsch,G5222 Electromatic Double Jet BT IL Walnut Stain Električna gitara,555 €,N/A,N/A,Samo po narudžbi
1482,Gretsch,G2215-P90 Streamliner JR Jet Club Havana Burst Električna gitara,411 €,N/A,N/A,Samo po narudžbi
1483,Gibson,ES-335 Figured Sixties Cherry Jazz gitara,3.698 €,N/A,N/A,Samo po narudžbi
1484,Fender,American Vintage II 1977 Telecaster Custom RW Olympic White Električna gitara,2.339 €,N/A,N/A,Na zalihi kod dobavljača
1485,Epiphone,Jim James ES-335 Walnut Jazz gitara,899 €,N/A,N/A,Samo po narudžbi
1486,Yamaha,Pacifica 611VFM Tobacco Sunburst Električna gitara,933 €,N/A,N/A,Na zalihi kod dobavljača
1487,Gibson,Les Paul Studio (Cream Trim) Cherry Sunburst Električna gitara,1.829 €,N/A,N/A,Samo po narudžbi
1488,Epiphone,Les Paul Standard 60s Figured Fireball Električna gitara,807 €,N/A,N/A,Samo po narudžbi
1489,Fender,Vintera II 60s Telecaster RW Sonic Blue Električna gitara,1.090 €,N/A,N/A,Samo po narudžbi
1490,Jackson,X Series Dinky DKAF7 IL Mahogany Stain Električna gitara,648 €,N/A,N/A,Samo po narudžbi
1491,Gibson,SG Tony Iommi Signature Vintage Cherry Električna gitara,2.229 €,N/A,N/A,Samo po narudžbi
1492,SX,Vintage ST 57 Black Električna gitara,229 €,N/A,N/A,Samo po narudžbi
1493,ESP,LTD TE-1000 Black Blast Električna gitara,1.629 €,N/A,N/A,Na zalihi kod dobavljača
1494,Epiphone,Power Players SG Dark Matter Ebony Električna gitara,312 €,N/A,N/A,Samo po narudžbi
1495,Fender,Player Plus Stratocaster PF Opal Spark Električna gitara,1.029 €,N/A,N/A,Na zalihi kod dobavljača
1496,Schecter,C-7 Deluxe Satin Black Električna gitara,479 €,N/A,N/A,Samo po narudžbi
1497,Cort,CR100 Cherry Red Burst Električna gitara,294 €,N/A,N/A,Samo po narudžbi
1498,ESP,LTD AW-7 Baritone Alex Wade Open Grain Black Električna gitara,2.299 €,N/A,N/A,Na zalihi kod dobavljača
1499,Schecter,C-1 SGR Walnut Satin Električna gitara,335 €,N/A,N/A,Na zalihi kod dobavljača
1500,Epiphone,ES-335 Figured Sixties Cherry Jazz gitara,687 €,N/A,N/A,Samo po narudžbi
1501,ESP,LTD EC-01 FT Vintage Burst Električna gitara,1.219 €,N/A,N/A,Samo po narudžbi
1502,Jackson,JS22 SC Monarkh AH Snow White Električna gitara,228 €,N/A,N/A,Samo po narudžbi
1503,Vintage,V100 HB Flame Honeyburst Električna gitara,557 €,N/A,N/A,Samo po narudžbi
1504,Schecter,PT Van Nuys Gloss Natural Ash Električna gitara,1.089 €,N/A,N/A,Samo po narudžbi
1505,Epiphone,Les Paul Prophecy Aged Jet Black Metallic Električna gitara,1.190 €,N/A,N/A,Samo po narudžbi
1506,Fender,Squier Affinity Series Stratocaster Junior HSS LRL Ice Blue Metallic Električna gitara,227 €,N/A,N/A,Samo po narudžbi
1507,Schecter,Omen-7 Vintage White Električna gitara,723 €,N/A,N/A,Samo po narudžbi
1508,Fender,Player Series Stratocaster PF Polar White Električna gitara,796 €,N/A,N/A,Samo po narudžbi
1509,Gibson,1957 Les Paul Goldtop Reissue VOS Električna gitara,4.839 €,N/A,N/A,Samo po narudžbi
1510,ESP,LTD EC-1000 QM See Thru Purple Sunburst Električna gitara,1.369 €,N/A,N/A,Na zalihi kod dobavljača
1511,Schecter,SGR-C1 FR Metallic Red Električna gitara,426 €,N/A,N/A,Na zalihi kod dobavljača
1512,Cort,KX 507MS Star Dust Black Električna gitara,739 €,N/A,N/A,Samo po narudžbi
1513,Schecter,BANSHEE-6 SGR Gloss Black Električna gitara,335 €,N/A,N/A,Na zalihi kod dobavljača
1514,Encore,E90 Blaster Pack Tobacco Sunburst Električna gitara,246 €,N/A,N/A,Samo po narudžbi
1515,Epiphone,Wilshire P-90s Cherry Električna gitara,505 €,N/A,N/A,Samo po narudžbi
1516,Epiphone,Les Paul Modern Faded Pelham Blue Električna gitara,742 €,N/A,N/A,Samo po narudžbi
1517,Gibson,1957 Les Paul Junior Single Cut Reissue VOS Vintage Sunburst Električna gitara,3.690 €,N/A,N/A,Samo po narudžbi
1518,Fender,Vintera II 60s Stratocaster RW Lake Placid Blue Električna gitara,1.090 €,N/A,N/A,Samo po narudžbi
1519,Fender,Player Plus Telecaster MN Sienna Sunburst Električna gitara,984 €,999 €,N/A,Samo po narudžbi
1520,Gretsch,G5420T Electromatic SC LRL Walnut Stain Jazz gitara,742 €,N/A,N/A,Samo po narudžbi
1521,Epiphone,1963 Firebird I Heather Poly Električna gitara,1.559 €,N/A,N/A,Samo po narudžbi
1522,Ibanez,AS93FM-VLS Violin Sunburst Jazz gitara,759 €,N/A,N/A,Samo po narudžbi
1523,Schecter,C-1 FR SGR Midnight Satin Black Električna gitara,427 €,N/A,N/A,Na zalihi kod dobavljača
1524,ESP,LTD Phoenix-1000 Evertune Silver Sunburst Satin Električna gitara,1.649 €,N/A,N/A,Na zalihi kod dobavljača
1525,Gibson,Les Paul Special Vintage Cherry Električna gitara,1.609 €,N/A,N/A,Samo po narudžbi
1526,Yamaha,RSP20 Sunset Burst Električna gitara,1.759 €,N/A,N/A,Na zalihi kod dobavljača
1527,Jackson,JS Series Monarkh SC JS22Q AH Transparent Purple Burst Električna gitara,358 €,N/A,N/A,Na zalihi kod dobavljača
1528,Epiphone,Les Paul Modern Graphite Black Električna gitara,724 €,N/A,N/A,Samo po narudžbi
1529,Fender,Player Series Stratocaster HSH PF Silver Električna gitara,926 €,N/A,N/A,Samo po narudžbi
1530,Epiphone,Power Players Les Paul Dark Matter Ebony Električna gitara,315 €,N/A,N/A,Samo po narudžbi
1531,Jackson,X Series Soloist SL3X DX Yellow Crackle Električna gitara,746 €,N/A,N/A,Na zalihi kod dobavljača
1532,Guild,Surfliner Deluxe Scarlet Red Metallic Električna gitara,809 €,N/A,N/A,Samo po narudžbi
1533,SX,Vintage TL 50 2-Tone Sunburst Električna gitara,217 €,N/A,N/A,Samo po narudžbi
1534,Guild,Starfire I DC Cherry Red Jazz gitara,624 €,N/A,N/A,Samo po narudžbi
1535,Fender,American Ultra II Meteora MN Avalanche Električna gitara,2.759 €,N/A,N/A,Samo po narudžbi
1536,Fender,American Ultra II Telecaster MN Sinister Red Električna gitara,2.649 €,N/A,N/A,Samo po narudžbi
1537,Ibanez,RG5120ML-FCN Frozen Ocean Električna gitara,2.009 €,N/A,N/A,Samo po narudžbi
1538,D'Angelico,Premier SS Solid Black Jazz gitara,798 €,N/A,N/A,Samo po narudžbi
1539,Epiphone,1959 Les Paul Standard Električna gitara,982 €,N/A,N/A,Samo po narudžbi
1540,Fender,American Ultra Stratocaster HSS MN Ultraburst Električna gitara,2.519 €,N/A,N/A,Na zalihi kod dobavljača
1541,Fender,American Ultra II Stratocaster MN Solar Flare Električna gitara,2.649 €,N/A,N/A,Samo po narudžbi
1542,Fender,American Ultra II Stratocaster HSS MN Solar Flare Električna gitara,2.679 €,N/A,N/A,Samo po narudžbi
1543,Gibson,Les Paul Studio Session Black Trim Cobalt Burst Električna gitara,2.199 €,2.309 €,- 5 %,Samo po narudžbi
1544,Ibanez,RG5121L-DBF Dark Tide Blue Flat Električna gitara,1.839 €,N/A,N/A,Samo po narudžbi
1545,Yamaha,Pacifica 612 VIIX Mist Green Električna gitara,986 €,N/A,N/A,Samo po narudžbi
1546,Gibson,ES-339 Cherry Jazz gitara,2.639 €,N/A,N/A,Samo po narudžbi
1547,Gibson,1961 Les Paul SG Standard SB Cherry Red Električna gitara,4.049 €,N/A,N/A,Samo po narudžbi
